"Ukraine tensions: Biden and Putin phone call seeks 'diplomatic path'", "US President Joe Biden is set to hold talks with Russia's Vladimir Putin for the second time this month, in a bid to de-escalate tensions over Ukraine. //US President Joe Biden is set to hold talks with Russia's Vladimir Putin for the second time this month, in a bid to de-escalate tensions over Ukraine. //The two leaders will speak by phone on Thursday.//They will discuss forthcoming security talks between the countries and the situation in Europe, a White House official said.//Russia, which recently built up forces on the border with Ukraine, denies planning to invade the country.//It says its troops are there for exercises, and that it is entitled to move its troops freely on its own soil.//Hours before the call, Mr Putin told Mr Biden in a holiday message he was "convinced" the pair could work together based on "mutual respect and consideration of each other's national interests".//His spokesman, Dmitry Peskov, said Moscow was "in the mood for a conversation".//A day earlier, a US official told AFP news agency that Mr Biden would offer his Russian counterpart a "diplomatic path" but remained "gravely" concerned by the Russian troop build-up on the border.//The head of Ukraine's national security council, Oleksiy Danilov, sought to downplay that on Thursday, suggesting the number of troops was not currently increasing: "As for the troops build-up near our borders reported by foreign media - we do not see that. There is a certain increase of [Russian] military and we closely monitor what's happening at our borders."//Less than a month ago, Ukraine's defence minister told parliament - citing intelligence reports - that Russia had massed more than 94,000 troops near the border and could be gearing up for a large-scale military offensive at the end of January.//No time for war: Russians see no chance of conflictUS and Russia to talk as Putin hits out on Ukraine//The US has consulted European leaders ahead of the call to co-ordinate a common response to the Ukraine issue, according to a White House statement. //While Ukraine is not a Nato member, it has close ties with the bloc.//Russia has said it wants legally binding guarantees that Nato will not move eastwards and that weapons will not be sent to Ukraine or any neighbouring countries. //Nato Secretary-General Jens Stoltenberg has been adamant that Ukraine's membership of the alliance is a matter for Nato and Kyiv. "Any dialogue with Russia has of course to respect the core principles which European security has been based on," he previously said.//Lithuanian President Gitanas Nauseda has described the current situation as probably "the most dangerous it's been in 30 years". //Russian officials are due to meet US counterparts in Geneva on 10 January. Asked earlier this week if he would meet Mr Putin on that date, Mr Biden replied "We'll see", but he is not expected to attend the talks in Geneva. ", 7.1%
"Covid: US halves isolation time for asymptomatic infection", "US health officials have halved the recommended isolation time for people with asymptomatic Covid-19 from 10 to five days, amid a surge in cases.//US health officials have halved the recommended isolation time for people with asymptomatic Covid-19 from 10 to five days, amid a surge in cases.//The measure is expected to alleviate disruption caused by staff shortages in many areas because of infections.//The Centers for Disease Control (CDC) says most transmissions happen in the two days before and three days after symptoms develop.//But experts have criticised the lack of testing requirements to end isolation.//The sharp rise in cases has been fuelled by the Omicron variant of the virus, which is now dominant in the US. Early studies suggest Omicron is more contagious than other variants, although milder. //The growing number of people having to isolate has put pressure on several industries, including air travel, with thousands of flights cancelled during the Christmas holiday.//Leaders of major US airlines were among those calling for the change, as cancellations continued for a fourth day on Tuesday. //The CDC said the new guidance was "motivated by science", and that the isolation must be followed by five days of wearing a mask around others. The announcement came as more than 200,000 daily infections were confirmed in the past two days nationwide. //CDC director Dr Rochelle Walensky said the recommendation "balances what we know about the spread of the virus and the protection provided by vaccination and booster doses".//"These updates ensure people can safely continue their daily lives," Dr Walensky said in a statement.//But there was no recommendation for people to take rapid at-home tests before the end of their isolation periods. Many experts say such tests help to show whether people continue to spread the virus.//Dr Michael Mina, an assistant professor at Harvard TH Chan School of Public Health, called the lack of such requirement "reckless".//"I absolutely don't want to sit next to someone who turned Positive 5 days ago and hasn't tested [negative]," he said on Twitter.//In England, people are now required to isolate for seven days, instead of 10, with two negative lateral flow tests needed to end their self-isolation - the first no earlier than day six of isolation and a second 24 hours later.//Speaking on CNN, the top US infectious disease expert said the CDC decision would allow people to return to work more quickly, calling it "very prudent" and a "good choice".//"With the sheer volume of new cases that we're having and that we expect to continue with Omicron, one of the things we want to be careful of is that we don't have so many people out," Dr Anthony Fauci, who also serves as President Joe Biden's chief medical adviser, said.//Infectiousness is not like a switch. It does not just go on to off. Instead, people with Covid gradually go from a period of peak infectiousness to lower infectiousness.//The most infectious period starts a few days before symptoms develop. This is one of the reasons why the virus is so hard to contain. After about five days, the risk of passing on the virus will start to decline for most people.//But it is still possible to pass on the virus. That is why when countries started introducing isolation periods many went for 14 days. It was a belt-and-braces approach. But over time these isolation periods have been reduced, reflecting the reduced threat the virus presents as vaccines have been rolled out.//In England it has now been set at seven days if you are negative using a rapid test. That should give people a good idea if they have passed peak infectiousness and reflects the fact the UK has made these rapid tests easily accessible to everyone.//The US approach for people without symptoms is grounded in research that suggests these cases are likely to be less infectious to start with. At the end of the day, it is all about balancing the risks - from both the virus and our responses to it.//The CDC also shortened the quarantine period for people exposed to someone infected. Unvaccinated people will be required to quarantine for five days after exposure, down from 14.//The same applies to people who were more than six months on from their second dose of the Pfizer or Moderna vaccines, or two months after a Johnson & Johnson dose, and had not yet received a booster shot.//Last week, the CDC reduced the recommended isolation time for asymptomatic health workers from 10 to seven days. But they were required to take a test to end their isolation period.//While the new recommendations are not mandatory, they are closely followed by many businesses and policymakers across the US.//EXPLAINER: Omicron up to 70% less likely to need hospital careIN CHARTS: Tracking the pandemic//On Monday, President Biden pledged to deal with a shortage of tests as Omicron threatens to overwhelm hospitals.//"Seeing how tough it was for some folks to get a test this weekend shows that we have more work to do," he said as he joined a call with the administration's Covid response team and state governors. "It's clearly not enough."//New steps will include improving at-home test manufacturing and making it easier to use Google to locate nearby test centres, he said.//Different states and local authorities in the US are introducing new measures in a bid to combat rising cases. New vaccine requirements have come into force in New York City, including a vaccine mandate for private-sector workers in the city. ", 4.5%
"'Let's go, Brandon': Caller pranks Biden at White House event", "A caller has pranked US President Joe Biden by dropping an anti-Biden taunt into their chat during a White House Christmas event.//A caller has pranked US President Joe Biden by dropping an anti-Biden taunt into their chat during a White House Christmas event.//Mr Biden and First Lady Jill Biden were hosting the festive call for families when a father told the president: "Let's go, Brandon."//Apparently unaware of the gibe, Mr Biden said he agreed. //The term, which has become a rallying cry for many conservatives, is code for a profane insult directed at Mr Biden.//The first couple were speaking virtually with children for a White House custom, tracking the journey of Santa's sleigh via the North American Aerospace Defence Command.//During Friday's event in the South Court Auditorium of the executive mansion, the Bidens spoke with a family from Oregon: Griffin, 11, Hunter, three, Piper, four, Penelope, two, and their father, Jared.//"I assume you're dad," the Democratic president said.//"Hi. Yes sir," replied Jared.//"OK, Dad, what do you want for Christmas?" asked Mr Biden.//"Maybe a quiet night," he replied laughing.//It all began at the end of a televised Nascar stock car race in Talladega, Alabama, on 2 October. NBC reporter Kelli Stavast was interviewing the winner, driver Brandon Brown, when members of the crowd in the grandstand behind them began chanting an obscenity directed at the president.//It was clearly picked up on the broadcast's audio.//Whether by mistake or as an attempt to deflect from the swearing on live television, Ms Stavast told Mr Brown the crowd was cheering him on with chants of "Let's go, Brandon." //A meme was born.//How 'Let's go Brandon' became an anti-Biden jeer//The president said: "You know, Dad, we have a Hunter, too. We have a son named Hunter and a grandson named Hunter."//"I didn't know you had a grandson named Hunter, that's cool," said Jared.//The president asked how old was Griffin.//"I'm 11," Griffin said. He said he wanted a piano.//Jared interjected: "I was going to say he has to cut some trees down to get a piano!"//Hunter wanted a Nintendo Switch, Piper wanted a Barbie.//The chuckling president reminded the children to be in bed by nine o'clock otherwise Santa might not show up.//The first lady said: "Have a merry Christmas, have a wonderful Christmas."//Mr Biden told Jared: "I hope you have a wonderful Christmas."//The father replied: "Yeah, I hope you guys have a wonderful Christmas as well. Merry Christmas and let's go, Brandon."//The president replied: "Let's go, Brandon. I agree."//There was silence.//Mr Biden added: "Hey, by the way, are you in Oregon? Where's your home? I think we lost him."//According to a recent Gallup poll, only 5% of voters who identify as Republican currently approve of the president's performance.//That same poll shows Mr Biden's overall approval rating has dipped to 43%.", 11.2%
"Omicron: Biden denies failure in pandemic testing response", "US President Joe Biden has denied his administration bungled its response to the emergence of the Omicron variant.//US President Joe Biden has denied his administration bungled its response to the emergence of the Omicron variant.//He told a TV network that "nobody" could have predicted it. His top adviser Dr Anthony Fauci has said experts did foresee variants. //It comes a day after the White House unveiled plans to order 500 million at-home coronavirus tests amid a shortage. //There have been long waits for in-person tests as Christmas looms.//"I don't think it's a failure," Mr Biden said in a sit-down interview with ABC News on Wednesday. "I think it's - you could argue that we should have known a year ago, six months ago, two months ago, a month ago."//The Democratic president said he wished he "had thought" about ordering the 500 million test kits "two months ago".//One year ago Mr Biden lambasted a shortfall in Covid-19 testing under the Trump administration as "a travesty".//On Wednesday, New York City recorded nearly 29,000 new cases - a new single day record during the pandemic and a 30% jump from the record set earlier this week. //Pressed by ABC on US Vice-President Kamala Harris' remarks to the Los Angeles Times last week that the White House did not see Delta or Omicron coming, Mr Biden laughed. //"How did we get it wrong?" he responded. "Nobody saw it coming. Nobody in the whole world. Who saw it coming?" //On Tuesday, the White House also pledged to open more testing sites around the country. //What's the risk of Covid for unvaccinated Americans?Omicron wave appears milder, but concern remains//In a briefing on Wednesday, Biden spokeswoman Jen Psaki was unable to provide specifics about how and when the free test kits would be distributed.//On Sunday, top White House coronavirus adviser Dr Fauci dismissed any suggestion that the emergence of new Covid variants could not have been predicted. //"We certainly were anticipating that there were going to be variants," he told CNN. "Because when you have so much replication going on in the community, if you give a virus enough opportunity to replicate you know it's going to ultimately mutate.//"And sometimes those mutations become a new variant, and that's what happened with Delta, and certainly with Omicron."//President Biden also told ABC News that he plans to run for re-election in 2024.//"But look, I'm a great respecter of fate. Fate has intervened in my life many, many times. If I'm in the health I'm in now, if I'm in good health, then in fact, I would run again," he said.//Mr Biden added that the chance of facing his predecessor, Donald Trump, "would increase the prospect of running".", 8.6%
"Covid Omicron: Biden buys 500m test kits to tackle surge", "US President Joe Biden has said 500 million Covid rapid tests will be made available at no cost amid new measures to tackle the surging Omicron variant.//US President Joe Biden has said 500 million Covid rapid tests will be made available at no cost amid new measures to tackle the surging Omicron variant.//Mr Biden also announced expanded testing and military support for hospitals, but said lockdowns were not yet on the horizon.//"This is not March of 2020," he said. "We're prepared. We know more." //Omicron has become the dominant strain in the US, accounting for nearly three-quarters of all new cases.//It was first identified in southern Africa last month but has now spread around the globe.//Only one death in the US has been linked to the new variant: a 50-year-old from Harris County, Texas, who had an underlying health condition and was unvaccinated.//Although 73% of adult Americans are fully vaccinated against Covid, the administration remains concerned about those who have not had jabs.//Scientists probe link between variants and untreated HIV//Speaking on Tuesday, Mr Biden again implored Americans to protect themselves and get vaccinated. //He acknowledged that some vaccinated Americans would also be infected but he stressed that the unvaccinated have "a significantly higher risk of ending up in the hospital, or even dying". //"If you're not fully vaccinated you have reason to be concerned," said an unmasked Mr Biden, who coughed into his hand during his remarks.  //Those who have been vaccinated and have had no exposure to Covid-19 may go ahead with Christmas celebrations, the president said. //The White House said the new measures would "mitigate the impact unvaccinated individuals have on our healthcare system".//In the same speech, he acknowledged that his vaccine mandates have been "unpopular". //"My administration has put them in place not to control your life, but to save your life and the lives of others," he said. //His administration is facing a barrage of lawsuits as it seeks to require federal contractors, healthcare providers and private companies to ensure their employees are vaccinated.//Mr Biden also offered a rare thumbs-up for former President Donald Trump, who was booed on Sunday after telling an audience in Dallas, Texas, that he had received his booster shot. //"Maybe one of the few things he and I agree on," Mr Biden said of his political rival.//The key measures are://500 million at-home rapid tests (antigen/flow) will be bought and delivered free to all Americans who request them from January. Kits can currently cost $7-$15 (£5-£11) over-the-counter and availability can be sketchy in some areas1,000 military medical personnel will be deployed to hospitals nationwide over the next two months, five times the current amountThe launch of new federal testing sites nationwide, with the first in New York City - which has seen a massive surge in Omicron - by Christmas Expanded hospital capacity and distribution of critical supplies//Criticism of the US testing system has mounted in recent weeks, as at-home test kits are expensive and hard to find. The US lags behind other countries in terms of testing. //In the UK, at-home tests are provided for free from the government, and are otherwise much cheaper to purchase. //In Tuesday's speech, Mr Biden denied that the rollout of widespread testing had lagged. "It didn't take long at all," he said.//How worrying is the new Covid variant?How do you detect Omicron?Covid map: Where are cases the highest? //Covid-19 cases in the US nationally are up 57% since the start of this month, Reuters reports.//As the purchase of 500 million tests was announced, White House press secretary Jen Psaki expressed regret for having poured scorn on the idea just two weeks ago.//When a reporter asked on 6 December why the Biden administration had not made at-home tests available free to every citizen, as the UK and Singapore have done, Ms Psaki shot back: "Should we just send one to every American? Then what happens if every American has one test? How much does that cost, and then what happens after that?"", 5.0%
"Senator Joe Manchin threatens to sink signature Biden bill", "A Democratic senator has said he will not support a major social spending plan, throwing the US president's flagship legislation into jeopardy. //A Democratic senator has said he will not support a major social spending plan, throwing the US president's flagship legislation into jeopardy. //"I cannot vote to continue with this piece of legislation," Joe Manchin told Fox News of the $1.9tn (£1.4tn) bill.//Fellow Democrats, including President Joe Biden, have spent weeks trying to secure Mr Manchin's crucial support.//All 50 Democrats are needed to pass the bill in the Senate, with opposition Republicans staunchly opposed. //The Build Back Better Act is a sweeping social spending and climate package, which is considered a key pillar of Mr Biden's agenda.//It would increase funding for government health-insurance programmes, expand tax credits for low-income families, provide government-funded universal preschool, and invest hundreds of billions of dollars in addressing climate change. It would be mostly paid for by raising  taxes on the wealthy and corporations. // It passed the House of Representatives last month following a vote that largely fell along party lines, but was expected to face significant hurdles in the Senate. //Republicans say the legislation will fuel inflation and damage the economy.//On Sunday, the Democratic West Virginia senator said he had "worked as diligently as possible... to determine the best path forward despite my serious reservations".//"My Democratic colleagues in Washington are determined to dramatically reshape our society in a way that leaves our country even more vulnerable to the threats we face.//"I cannot take that risk with a staggering debt of more than $29tn and inflation taxes that are real and harmful to every hard-working American at the gasoline pumps, grocery stores and utility bills with no end in sight," Mr Manchin said.//The White House said Mr Manchin's comments marked a "breach of his commitments" to Mr Biden as well as his Democratic colleagues in Congress.//"We will continue to press him to see if he will reverse his position yet again, to honor his prior commitments and be true to his word," it said. //"The fight for Build Back Better is too important to give up. We will find a way to move forward next year," it added. ", 12.0%
