"Voting rights: Is this now Joe Biden's biggest headache?", "Both Democrats and Republicans are concerned about the state of US democracy and the nation's electoral systems, although the two parties have very different ideas about what those problems are - let alone what the solutions should be.//Both Democrats and Republicans are concerned about the state of US democracy and the nation's electoral systems, although the two parties have very different ideas about what those problems are - let alone what the solutions should be.//Democrats in Washington have been trying to enact a series of sweeping new voting reforms, after Republican-controlled states imposed more stringent voting requirements last year.//On Tuesday, President Biden and Vice-President Kamala Harris will promote these legislative efforts in Georgia - a state that is both an electoral battleground and home to some of the more sweeping recent Republican-backed voting-law changes.//Given that Democrats currently control the White House and both chambers of the US Congress, much of the party's voting reform efforts has focused on legislation at the federal level. //Among the party's top priorities is restoring some of the most powerful enforcement mechanisms in the Voting Rights Act, a 1960s-era civil rights law that has been weakened in two major Supreme Court decisions, the first in 2013 and the second in 2021.//One of the provisions struck down - and which Democrats hope to reinstate - required the federal government to pre-approve changes to voting procedures in states with a history of discrimination. That power had been used by the Obama administration to delay moves as minor as the relocation of voting sites or as major as state-wide voter identification laws.//Another Democratic goal has been to ensure that the changes to voting procedures enacted during the pandemic, such as an expansion of early voting, the greater use of ballot drop boxes and easier access to absentee and mail-in voting, are kept in place in coming elections.//Democratic-controlled legislatures in some states, such as Virginia, Nevada and Maine, have already taken action. Democrats in Congress, however, are pushing to set federal standards that would apply to every state.//At least for the moment, Republicans are locked out of power at the national level, so their voting efforts have been focused on state legislatures under their party's control. They've passed limitations on mail-in absentee voting and the use of ballot drop boxes, among other steps. //Texas, for instance, passed a provision that bans drive-through voting, 24-hour voting locations and the distribution of unsolicited mail-in ballot applications by public officials - methods used by Democratic-controlled cities during the 2020 presidential election.//In Georgia, the Republican legislature enacted a law that restricts drop boxes - which were approved for widespread use in 2020 by the state's election board to address pandemic concerns - to one per 100,000 voters.//It also restricts their location to only inside election offices or early voting sites and their use only to early voting periods, and limits when a voter can request an absentee ballot to 67 days before election (down from six months).//Republican legislatures have also pushed for expanded use of photo identification during voting and better identity verification during the voter registration process.//Behind these two very different ideas about what constitutes voting reform are two very different ideas about the dangers currently facing the US.  //According to a CBS survey, 60% of Democrats and 74% of Republicans view democracy and the rule of law in the US as "somewhat" or "very" threatened. //But of those numbers, 79% of Republicans thought a major reason for this was "people voting or casting ballots illegally", while only 18% of Democrats agreed. Meanwhile, 89% of Democrats thought "people trying to overturn or change elections" was a major reason, something only half of Republicans believed.//The Republican view that the 2020 election was rife with fraud, even though there has been little concrete evidence to support this, animates their desire to pass new voting restrictions at the state level. //Democratic concerns about those efforts, even if many of them are an attempt to return to pre-pandemic systems that were heavily reliant on in-person voting in most states, have driven their efforts at the national level.//The high-stakes battle over US voting rightsWhy it’s easier to vote in Canada than the US//Democrats have opposed the kind of Republican-backed polling location and procedure changes that previously required federal approval. They argue that such changes are making voting more difficult for traditionally marginalized communities that often vote heavily Democratic.//Shortening early voting periods and hours can make it harder for blue-collar and service-industry workers to vote. They believe robust voting early and via mail can help avoid the long lines at polling places that have been an problem in traditionally Democratic precincts even before the pandemic.//In Georgia, for instance, the state's population has grown by about 2 million people since the 2013 Supreme Court case ending pre-approval of voting changes, but the number of polling locations has decreased by 10% - a trend that is mirrored in many other southern states previously covered by the Voting Rights Act. //Many Republicans, for their part, believe that judges and obscure election boards changed the rules of the game in 2020 under the guise of the pandemic in a way that increased the potential for fraud (and made it easier for Democratic constituencies to vote). //They point to the Pennsylvania Supreme Court, which allowed absentee ballots to be counted until three days after election day, and North Carolina, where the state board of elections extended the deadline for receiving ballots to nine days after election day.//A concern among Republicans is that Democrats - including those in liberal cities located in conservative states - are now trying to make those changes permanent in order to secure a voting advantage. Much of the Texas law, for instance, can be viewed as a direct response to measures to increase voting access in the Houston area, which has become a Democratic stronghold.//At the state level, the voting-reform die has already been cast. //According to a study by New York University's Brennan Center for Justice, 19 states passed laws restricting voting access in 2021 - more than any year since the centre began its monitoring in 2011. //Meanwhile, 25 states have undertaken steps to expand voting rights, including 15 that have made mail-in voting easier.//Democratic efforts in Congress continue to face the same legislative obstacles that have bedevilled the rest of Mr Biden's domestic agenda - unified Republican opposition coupled with a handful of centrist Senate Democrats who are unwilling to change legislative rules to pave the way for more sweeping reforms.//Mr Biden's renewed interest in the legislation will probably please his party's liberal wing, which views voting reform as essential to preserving American democracy (and protecting Democratic electoral prospects), but there is not much evidence at this point that even the most enthusiastic effort on the part of the president and his administration will produce tangible results.", 8.6%
"US Capitol attack: Rioters held dagger to the throat of America - Biden", "President Joe Biden has heavily criticised former President Donald Trump on the first anniversary of the attack on the US Capitol.//President Joe Biden has heavily criticised former President Donald Trump on the first anniversary of the attack on the US Capitol.//In a televised speech Mr Biden accused his predecessor of spreading "a web of lies" that led to the mob's assault. //Trump supporters stormed the Capitol building on 6 January 2021 as Congress gathered to certify Mr Biden's presidential election victory.//Live footage of US politicians cowering from the mob shocked the world.//Mr Trump had urged protesters at a rally outside the White House shortly beforehand to "peacefully" march on Congress, but he also encouraged them to "fight" and stirred up the crowd with unsubstantiated claims of mass voter fraud in the election he had just lost. //Shortly after Mr Biden's speech on Thursday Mr Trump released an angry statement hitting out at his successor. In it, he accused Mr Biden of "failure" and repeated false claims about the election. //What happened to these Capitol rioters?Five big questions about Trump and the riot//Democrat politicians, who have a majority in the US Congress, planned a number of events to mark the one-year anniversary of the attack - including a candlelit vigil outside the Capitol building.//Many spoke about their experiences of the day, including sheltering and hiding from the rioters along with young members of staff.//A House committee is conducting an inquiry, and so far investigators have arrested 725 suspects in connection with the riot. //Mr Biden condemned the attackers and Mr Trump in his speech on Thursday, using some of his strongest language yet about both the Capitol riots and his predecessor.//"Those who stormed this Capitol and those who instigated this incidence, held a dagger at the throat of America and American democracy", Mr Biden said in Statuary Hall, a section of the Capitol complex that was breached by rioters.//"They came here in rage, not in the service of America, but rather, in the service of one man.//"The former president of the United States of America has created and spread a web of lies about the 2020 election... His bruised ego matters more to him than our democracy or our constitution". //The US leader also warned that the threats to American democracy "have not abated."//Later in the day House Speaker Nancy Pelosi presided over a moment of silence on the chamber floor. She praised police officers who defended lawmakers and other people who were sheltered inside as the riot raged. //"The insurrectionists targeted more than just the building. They targeted democracy itself," she said. //Some Republicans skipped the day's commemorative gatherings. The party's Senate leader, Mitch McConnell, led a delegation to the funeral of a former senator in Atlanta, Georgia. //Meanwhile Florida congressman Matt Gaetz and Georgia congresswoman Marjorie Taylor Greene - two provocative pro-Trump members of the House - held a news conference at the Capitol billed as a "Republican response" to the day's events. //They repeated unsubstantiated theories that the attack was fuelled by federal agents.//The mother of Ashli Babblit, a US Air Force veteran who died after being shot by police while trying to storm the House of Representatives, also spoke outside Congress. //"She was a patriot. She served this country her whole adult life," Micki Witthoeft told the Alabama-based Right Side Broadcasting Network.//Republican Senator Lindsey Graham, in a tweet, accused Mr Biden of "brazen politicisation" of the 6 January riot.  //Last January, Joe Biden gave an inaugural address outside the US Capitol that focused on national healing and unity.//Now, standing in the centre of the building nearly a year later - after it has become clear that the nation is as divided as ever - Biden put unifying rhetoric aside and took dead aim at Donald Trump and his supporters.//In some of the sharpest words directed at his predecessor since the 2020 presidential campaign, Biden condemned Trump's continued efforts to question the legitimacy of that election.//Not only that, he blasted Republicans who continue to stand behind the former president and endorsed national efforts to enact election reform to counter what he said were Trump-backed attempts to undermine voting rights.//This is an election year in America, with control of the US Congress and several key states hanging in the balance.//Biden's rhetorical shift could represent a strategic shift, as well - a decision that the Democratic base can most effectively be rallied with anger, not hope.", 5.0%
"How the US marked the Capitol riot anniversary", "American lawmakers gathered at the Capitol one year after a mob stormed the building. President Biden delivered a speech condemning former President Donald Trump. Republicans accused him and Democrats of politicising the event.", 0.0%
"Biden accuses Trump of creating a web of lies", "The US President Joe Biden has said that Donald Trump has a bruised ego and cannot accept that he lost the election.He was speaking a year after rioters stormed the US Capitol building.Show more", 0.0%
"Capitol riots: Trump tried to prevent peaceful transition, says Biden", "US President Joe Biden has criticised former president Donald Trump, stating that he tried to prevent the peaceful transfer of power.Speaking on the first anniversary of the storming of the US Capitol building, Mr Biden says the country must sure another attack never happens again.Show more", 12.3%
"Capitol riot: Biden to blame Trump for 'carnage' one year on", "President Joe Biden will blame Donald Trump for the US Capitol riot as he marks the anniversary of the attack on the seat of American democracy. //President Joe Biden will blame Donald Trump for the US Capitol riot as he marks the anniversary of the attack on the seat of American democracy. //Speaking at Congress, Mr Biden will say his predecessor holds "singular responsibility" for the "chaos and carnage", said spokeswoman Jen Psaki. //Investigators have so far arrested 725 suspects in connection with the attack. //Trump supporters stormed the building as Congress was meeting to certify Mr Biden's presidential election victory. //Images of US lawmakers cowering from the mob in the gallery of the House of Representatives on that afternoon of 6 January 2021 shocked the world.//Mr Trump had urged protesters at a rally outside the White House shortly beforehand to "peacefully" march on Congress, but he also exhorted them to "fight" and stirred up the crowd with unsubstantiated claims of mass voter fraud in the election he had just lost.//The former president had planned to host a competing news conference on Thursday from his Mar-a-Lago resort home in Palm Beach, Florida. But he cancelled the event after aides reportedly warned of negative press coverage.//A spokesman for Mr Trump, Taylor Budowich, said it was "unsurprising" that Mr Biden would spend the day "trying to further divide our nation" in an attempt to distract voters from rising inflation and crime and coronavirus school closures.//President Biden - who rarely mentions his predecessor - will speak on Thursday morning in Statuary Hall, a section of the Capitol complex that was breached by rioters.//The White House press secretary said the president's speech "will lay out the significance of what happened at the Capitol, and the singular responsibility President Trump has for the chaos and carnage that we saw".//"He will forcibly push back on the lies spread by the former president - in an attempt to mislead the American people, and his own supporters, as well as distract from his role in what happened," she added.//"President Biden has been clear-eyed about the threat the former president represents to our democracy," Ms Psaki continued. //House Speaker Nancy Pelosi will preside over a moment of silence at noon on the chamber floor.//An inquiry into the riot is being conducted by a House committee, which is dominated by President Biden's Democrats.//The panel is chasing phone records, visitor logs and other White House documents that could shed light on events leading up to the attack on Congress. They have issued legal summonses to members of Mr Trump's inner circle. //What happened to these Capitol rioters?Five big questions about Trump and the riot//Senior Republicans will mostly be outside of Washington on Thursday, with the party's Senate leader, Mitch McConnell, heading a delegation to the funeral of a former senator in Atlanta, Georgia. Mr McConnell said in the immediate aftermath of the riot that Mr Trump was "practically and morally responsible". //Some Republican lawmakers have portrayed the invasion of Congress, in which rioters engaged in hand-to-hand combat with police, as a peaceful protest that was spoiled by a few troublemakers. //But conservative Republican Senator Ted Cruz of Texas was lambasted on the right on Wednesday after he labelled the riot "a violent terrorist attack".//US Attorney General Merrick Garland gave an update on the FBI inquiry on the eve of the anniversary, calling the law enforcement operation "one of the largest, most complex and most resource-intensive investigations in our history".//"The actions we have taken thus far will not be our last," he said. "We will follow the facts wherever they lead because 6 January was an unprecedented attack on the seat of our democracy."//He said 140 police officers had been assaulted, including one who was beaten and zapped repeatedly with a stun gun until he had a heart attack. //Another screamed for help as rioters crushed him between doors and bludgeoned him with his own weapon, said the attorney general.//Mr Garland is facing pressure from the left to prosecute the rioters more aggressively, as well as charge the former president himself and his allies. //"We build investigations by laying a foundation," Mr Garland said. "We resolve more straightforward cases first because they provide the evidentiary foundation for more complex cases."//Most of the charges so far have been misdemeanours that often entail no jail time in the event of a conviction. //These suspects have been charged with trespassing, disorderly conduct, parading, demonstrating or picketing in a Capitol building, and obstructing congressional proceedings. //Who stormed the Capitol?Capitol riots timeline: How the day unfolded//But 325 suspects are facing felonies - more serious counts - such as using a dangerous weapon to assault officers.//Mr Garland said 300,000 tips had been submitted by private citizens, and the FBI were still hunting about 2,500 suspects. //One rioter, an unarmed woman, Ashli Babbitt, was shot by an officer while trying to breach the House chamber. Two others died from natural causes related to cardiovascular disease and another succumbed to a drug overdose. //Capitol Police Officer Brian Sicknick died a day later of natural causes after suffering two strokes while defending the building, according to medical officials. //In an opinion piece for the New York Times on Wednesday, the oldest-living former US President, Jimmy Carter, warned that the country "now teeters on the brink of a widening abyss". //"Without immediate action, we are at genuine risk of civil conflict and losing our precious democracy. Americans must set aside differences and work together before it is too late."//A week after the riot, Mr Trump was impeached by the House for incitement of insurrection, but acquitted by the Senate, which was then controlled by his fellow Republicans. He is still seen as holding sway over the party.//Of 10 Republicans who sided with Democrats in the lower chamber vote, two have resigned amid death threats, three others are facing Trump-backed election challenges, and four more have kept a low profile. //Wyoming's Liz Cheney was stripped of her Republican leadership position in the House, but is spearheading the congressional inquiry into the Capitol riot.//National divisions over the invasion of Congress are underscored by BBC interviews with American voters. //James Clark, 69, a life-long Republican voter in Virginia, said: "It was truly shocking. President Trump seemed intent on burning down the house before leaving Washington." //But Trump voter Keri Smith, 42, of Texas, argued that the Black Lives Matter protests were worse.//"We've seen stuff crazier than that happening on a weekly basis for the past two years," she said. //Laura Powers, a disaffected Republican, says she is "still horrified" by what she watched on TV that day. //"It was a horrible, dark day for democracy and it should never ever happen again," she said.//The riot has been described as the worst assault on the Capitol since the War of 1812. It is not the only such attack since that era.//In 1983 a female-led communist group bombed the US Senate. No-one was injured. //One of the co-defendants in that attack had her sentence in another case commuted by US President Bill Clinton.", 4.5%
"Ukraine tensions: Putin tells Biden new sanctions could rupture ties", "Russia's Vladimir Putin has warned his US counterpart Joe Biden that imposing new sanctions over Ukraine could lead to a complete breakdown in relations.//Russia's Vladimir Putin has warned his US counterpart Joe Biden that imposing new sanctions over Ukraine could lead to a complete breakdown in relations.//In a phone call late on Thursday, the Russian president said such sanctions would be a "colossal mistake".//Mr Biden, meanwhile, told Mr Putin that the US and its allies would respond decisively to any invasion of Ukraine.//The call, requested by Russia, was the pair's second such conversation this month and lasted for almost an hour.//It marked the latest effort to defuse tensions over Ukraine's eastern border with Russia, where Ukrainian officials say more than 100,000 Russian troops have been sent.//The build-up has prompted concern in the West, with the US threatening Mr Putin with sanctions "like none he's ever seen" if Ukraine comes under attack.//Russia, however, denies it is planning to invade the country and says the troops are there for exercises. It says it is entitled to move its troops freely on its own soil.//No time for war: Russians see no chance of conflictIs Russia preparing to invade Ukraine? //Although the two sides exchanged warnings during the call, Russian foreign policy adviser Yuri Ushakov told reporters shortly after that Mr Putin was "pleased" with the conversation. He added that it had created a "good backdrop" for future talks.//A senior US official, who spoke on condition of anonymity, said the tone had been "serious and substantive."//"President Biden reiterated that substantive progress in these dialogues can occur only in an environment of de-escalation," White House Press Secretary Jen Psaki said.//"He made clear that the United States and its allies and partners will respond decisively if Russia further invades Ukraine," she added.//US and Russian officials are set to meet for in-person talks in Geneva next month, and the White House said Mr Biden urged his Russian counterpart to pursue a diplomatic solution.//In a holiday message before Thursday's call, Mr Putin told Mr Biden he was "convinced" the pair could work together based on "mutual respect and consideration of each other's national interests".//His spokesman, Dmitry Peskov, said Moscow was "in the mood for a conversation".//"We believe that only through talks is it possible to solve all the immediate problems that we have in abundance between us," Mr Peskov added.//White House officials sound calm when they talk about Ukraine, at least while speaking outside of the West Wing. //The phone call between President Biden and President Putin on Thursday, as a senior administration official told reporters in the early evening, was "a serious, substantive, conversation".//That official spoke in a measured voice about the talks, and sounded even-tempered when he spoke about the threat from Russia. Behind the scenes, though, he and others in the White House are deeply worried about a possible invasion of Ukraine.//The signs from Russia are "ominous", as one insider told me, and so the diplomatic pace has been stepped up. //On Thursday, at least, the two leaders were talking and those at the White House see this as a positive sign. For now. they are trying to do everything they can to make sure they keep talking into the new year.//Ukraine's defence minister told parliament at the start of December that Russia had massed tens of thousands of troops near the border, and could be gearing up for a large-scale military offensive at the end of January.//Russia has argued the military build-up at the border is a protective measure against Nato, the Western military alliance. It wants legally binding guarantees that Nato will not expand further east, and that certain weapons will not be sent to Ukraine or any neighbouring countries. //The US has rejected what it styles as a Kremlin bid to control the future of independent countries.//Ukraine has not been offered Nato membership, but has close ties with the bloc. //Tensions between Russia and Ukraine are nothing new. In 2014, Russia annexed Ukraine's Crimean Peninsula and soon after started to back a separatist insurgency in Ukraine's east that has seen some 14,000 people killed in periodic fighting.//Washington and its European allies have warned Russia to expect severe economic sanctions if troops do cross into Ukraine again. ", 4.4%
