"US Supreme Court blocks Biden's workplace vaccine mandate", "The US Supreme Court has blocked President Joe Biden's rule requiring workers at large companies to be vaccinated or masked and tested weekly.//The US Supreme Court has blocked President Joe Biden's rule requiring workers at large companies to be vaccinated or masked and tested weekly.//The justices at the nation's highest court said the mandate exceeded the Biden administration's authority.//Separately they ruled that a more limited vaccine mandate could stand for staff at government-funded healthcare facilities.//The administration said the mandates would help fight the pandemic.//President Biden, whose approval rating has been sagging, expressed disappointment with the decision "to block common-sense life-saving requirements for employees".//He added: "I call on business leaders to immediately join those who have already stepped up - including one third of Fortune 100 companies - and institute vaccination requirements to protect their workers, customers, and communities."//The puzzle of America's record Covid hospital rate//Former President Donald Trump cheered the court's decision, and said vaccine mandates "would have further destroyed the economy". //"We are proud of the Supreme Court for not backing down," he said in a statement. "No mandates!" //The administration's workplace vaccine mandate would have required workers to receive a Covid-19 shot, or be masked and tested weekly at their own expense.//It would have applied to workplaces with at least 100 employees and affected some 84 million workers. It was designed to be enforced by employers. //Opponents, including several Republican states and some business groups, said the administration was over-stepping its power with the requirements, which were introduced in November and immediately drew legal challenges.//In the end, Joe Biden's vaccine mandates stood or fell based on judicial interpretations of federal statute, not principles of individual liberty or appeals to the greater good.//According to a majority of the Supreme Court, Mr Biden had the law on his side when ordering healthcare workers to get vaccinated, but using a 51-year-old workplace safety statute to implement a vaccine-or-test requirement on all large employers was a bridge too far.//Once again, the current balance of the Supreme Court comes into sharp relief, with four reliably conservative justices, three reliable liberal ones and two - Chief Justice John Roberts and Justice Brett Kavanaugh - at the ideological fulcrum.//This mixed judicial bag is just the latest setback for a presidential Covid-response plan that frequently has seemed a step behind the latest twists in the pandemic. The administration was slow to encourage boosters and caught flat-footed by the Omicron-induced surge in demand for testing.//Now Mr Biden will either have to convince Congress to act on mandates - an unlikely prospect given the brick wall the rest of his agenda keeps hitting in the Senate - or figure out new ways to shepherd the nation out of the pandemic gloom.//In a 6-3 decision, the justices agreed with that argument, saying that the workplace safety rule for large employers was too broad to fall under the authority of the Department of Labor's Occupational Health and Safety Administration to regulate workplace safety.  //"Covid-19 can and does spread at home, in schools, during sporting events, and everywhere else that people gather," the court's majority wrote. //"That kind of universal risk is no different from the day-to-day dangers that all face from crime, air pollution, or any number of communicable diseases."//"This is no 'everyday exercise of federal power,'" they added. "It is instead a significant encroachment on the lives - and health - of a vast number of employees."//The more limited rule concerning more than 10 million staff at healthcare facilities that receive government funding did not pose the same concern, they decided, by 5-4.//That said imposing conditions on recipients of public money fit "neatly" into the authority of the Secretary of Health and Human Services.//The rulings come as some parts of the policies were due to go into effect this week. The court heard arguments in the case on Friday. //The rulings reflected the political make-up of the court, which now has a majority of justices appointed by Republican presidents. //The court's three liberal justices opposed blocking the vaccine mandate, saying such a decision "stymies the federal government's ability to counter the unparalleled threat that Covid-19 poses to our nation's workers."//Chief Justice John Roberts and Justice Brett Kavanaugh, seen as moderates in the conservative majority, joined the liberals in allowing the healthcare rule to stand. //The decision comes as the US experiences another wave of Covid-19 infections, with the Omicron variant spurring record cases and hospitalisation rates. //The Biden administration had estimated that instituting a vaccine requirement at big employers would save 6,500 lives and prevent 250,000 hospital admissions over six months.//More than 60% of Americans are fully vaccinated already. Independent of the government's regulations, some companies, including Google, Citibank and IBM, have started to move forward with their own requirements.//But the National Federation of Independent Businesses, a lobby group that was one of the lead plaintiffs challenging the government's workplace vaccine rule, had charged that it would burden small-business owners with new compliance costs, make it harder to fill positions and lead to lost profits and lost sales.//"Today's decision is welcome relief for America's small businesses, who are still trying to get their business back on track since the beginning of the pandemic," said Karen Harned, executive director of the group's legal arm.", 11.8%
"Biden plans dealt crushing blow by fellow Democrats", "President Joe Biden's hopes of overhauling the US election system look doomed after two of his fellow Democrats came out against them. //President Joe Biden's hopes of overhauling the US election system look doomed after two of his fellow Democrats came out against them. //Mr Biden has been arguing for the hugely controversial step of scrapping a key Senate norm to pass the bills.//But Senator Kyrsten Sinema said she refused to worsen the "disease of division infecting our country".//At the Capitol to arm-twist lawmakers, Mr Biden conceded he was "not sure" his plans would work.//He wants to repeal the filibuster, which requires a 60% majority to pass certain legislation in the Senate. The upper chamber of Congress is currently split 50-50 between the two parties. //No Republicans support the two Democratic-proposed plans, the Freedom to Vote Act and the John Lewis Voting Rights Advancement Act. Among other things, the bills would impose federal standards on elections, ushering in the most sweeping reform in a generation.//On Thursday, Mr Biden went to Congress in a last-ditch effort to persuade lawmakers to remove the filibuster so he could get the legislation passed. //But emerging from a meeting that lasted over an hour, he conceded that opposition from two key Democratic lawmakers had blocked his agenda. //"The honest to God answer is I don't know whether we can get this done," Mr Biden said.//"As long as I'm in the White House, as long as I'm engaged at all, I'm going to be fighting," he added. //Ms Sinema, an Arizona senator, and another Democrat, West Virginia Senator Joe Manchin, both said they would not support nuking the filibuster rule. //Speaking on the floor of the Senate, Ms Sinema said: "We must address the disease itself, the disease of division, to protect our democracy."//In a statement later on Thursday reiterating his position, Mr Manchin quoted Mr Biden's late friend, the former Senator Robert Byrd, who once warned against any attempt to scrap the filibuster.//"We must never, ever, ever, ever tear down the only wall, the necessary fence, that this nation has against the excesses of the executive branch and the resultant haste and tyranny of the majority," Mr Byrd said.//The crushing blow to Mr Biden's legislative agenda came on the day that the Supreme Court outlawed his national vaccine mandate, which was central to his coronavirus pandemic strategy.//Democrats have argued the voting bills are needed to counter recent voting laws enacted in state legislatures controlled by Republicans, who maintain that election security needs to be boosted. //But Mr Biden's incendiary rhetoric - likening Republican measures such as requiring ID to vote to the 1960s Civil Rights era when police billy clubs, fire hoses and dogs were used against black protesters - was described as "a little too far" by one of the president's own allies, Senator Dick Durbin, on Wednesday.//During his presidency, Donald Trump urged the Senate to remove the filibuster to secure funding for his proposed southern border wall.//While top Republican Mitch McConnell had removed the 60-vote threshold for confirming judicial nominees, he refused to take the so-called nuclear option and eliminate it altogether for legislation.", 7.6%
"Top Republican slams Biden voting speech as unpresidential", "Top Senate Republican Mitch McConnell has denounced US President Joe Biden's voting rights speech as "incoherent" and "profoundly unpresidential".//Top Senate Republican Mitch McConnell has denounced US President Joe Biden's voting rights speech as "incoherent" and "profoundly unpresidential".//"I have known, liked, and personally respected Joe Biden for many years," Mr McConnell said on the Senate floor.//"I did not recognise the man at the podium yesterday."//The remarks come one day after Mr Biden delivered a fiery speech in Atlanta calling for an overhaul of the US election system.//The president said he supported changes that would allow his party's proposed overhaul of the election system to be passed without the support of opposition Republicans.//Currently, a majority of 60% is needed to pass certain legislation in the Senate.//Mr Biden said the push to pass the legislation was a "battle for the soul of America", adding that the 60-vote rule - known as the filibuster - had rendered the Senate "a shell of its former self".//Biden pushes overhaul of US election lawsIs this now Joe Biden's biggest headache?//The upper chamber of Congress is currently split 50-50 between the two parties, therefore Mr Biden's sweeping election bills are almost certain not to pass unless there is a change to that rule.//But misgivings from two senators in his party are hampering his plans, and no Republicans have backed them.//In his speech, Mr Biden compared those that oppose election reform to believers in racial segregation and rebels in the US Civil War. He cast his supporters as civil rights leaders and abolitionists. //Addressing his colleagues in Washington on Wednesday, the Kentucky Republican senator slammed Mr Biden's comments as a "rant" that was "incoherent, incorrect, and beneath his office".//"Unfortunately, President Biden has rejected the better angels of our nature. So it is the Senate's responsibility to protect the country," Mr McConnell said.//He described Mr Biden's speech as evidence the filibuster must be preserved. //"You could not invent a better advertisement for the legislative filibuster than what we've just seen; a president abandoning rational persuasion for pure, pure, demagoguery," Mr McConnell said. //"A president shouting that 52 senators and millions of Americans are racist unless he gets whatever he wants is proving exactly why the framers built the Senate to check his power."//Even Biden ally and Democratic Illinois Senator Dick Durbin conceded that the president's tone may have been overheated.//The Senate majority whip told CNN: "Perhaps the president went a little too far in his rhetoric."//Meanwhile, former President Barack Obama threw his weight behind Mr Biden's calls to scrap the filibuster.//"And every American who cares about the survival of our most cherished institutions should support the president's call as well," he said in an op-ed for USA Today.//Senate Democrats plan to vote on the Freedom to Vote Act and the John Lewis Voting Rights Advancement Act by Monday.//If they fail to pass, as expected, the Senate will begin to consider changing filibuster rules. ", 8.6%
"Biden pushes overhaul of US election laws in fiery speech", "US President Joe Biden has called for a historic change to Senate rules as he seeks to overhaul the country's election laws.//US President Joe Biden has called for a historic change to Senate rules as he seeks to overhaul the country's election laws.//In an impassioned speech, he said he supported changes that would allow his voting reforms to be passed without the support of opposition Republicans.//Misgivings from two senators in his party are hampering his plans, and no Republicans have backed them.//Currently, a majority of 60% is needed to pass most legislation in the Senate.//And with the upper chamber of Congress split 50-50 between the two parties, Mr Biden's sweeping election bills are almost certain not to pass unless there is a change to that rule.//Such a change is unlikely, analysts say, as it would require the support of every Democrat in the Senate as well as the tie-breaking vote of the vice-president.//The bills - the Freedom to Vote Act and the John Lewis Voting Rights Advancement Act - passed the lower chamber, the House of Representatives, last year.//The former would introduce standardised, nationwide, voting rules as opposed to the current patchwork of state-by-state rules. The John Lewis Act, meanwhile, would require certain states to obtain government permission for any change to election regulations.//ANALYSIS: Is this now Joe Biden's biggest headache?CONTEXT: What is the filibuster and why does it matter?//"To protect our democracy, I support changing the Senate rules, whichever way they need to be changed, to prevent a minority of senators from blocking action on voting rights," the president said in a speech in Georgia on Tuesday.//"I've been having these quiet conversations with members of Congress for the last two months. I'm tired of being quiet," he added, while banging his fist on the lectern.//Mr Biden said the push to pass the legislation was a "battle for the soul of America", adding that the 60-vote rule - known as the filibuster - had rendered the Senate "a shell of its former self".//For much of the Senate's history unlimited debate was allowed, enabling opponents to block legislation. Supporters say it is a check on government power and forces administrations to seek consensus. //During World War One, rules were adopted to allow a two-thirds majority to bring debate to an end, but it was rarely used, and reduced to the 60-vote rule during the 1970s. //Joe Biden is making a renewed push for voting legislation, but the prospects for success haven't changed much since congressional Democrats first advanced the current package of proposals back in January 2019.//They're dim.//The reasons should be familiar to this White House. Either Democrats need to attract Republican support in the Senate, or they must change the rules to allow the slim Democratic majority there to approve the legislation on its own. Neither seems likely, no matter how many speeches Mr Biden gives.//Mr Biden's Georgia trip could simply be an attempt to satisfy restive members of his party's base, who believe the president is not doing enough to promote what they see as the most important issue facing the nation - and their party - today. But the outlook for success there doesn't look great, either. Some prominent voting rights activists are giving the Atlanta event a pass, viewing it as too little, too late.//Even Stacey Abrams, the Georgia gubernatorial candidate and tireless advocate of Democratic reforms, was absent, citing "scheduling conflicts".//Mr Biden may describe the coming voting rights showdown as a national "turning point", but the momentum is currently in a direction Democrats won't like.//Forecasts for this year's mid-term elections have spurred a sense of urgency among Democrats. Political analysts say the party risks losing control of Congress, and voting reform advocates have expressed frustration that the White House has not acted sooner.//Mr Biden said he was "an institutionalist who was honoured to serve in the Senate" for years, but he argued "the threat to our democracy is so grave" that he felt rule changes were necessary.//But in 2019, Mr Biden warned that doing away with the filibuster would be "very dangerous", pointing out that his fellow Democrats have used the rule often to block Republican legislation. Back in 2005, Mr Biden said any attempt to eliminate the filibuster was "an example of the arrogance of power". //Former President Donald Trump called for the filibuster to be scrapped when his fellow Republicans controlled the Senate, but then-Senate Majority leader Mitch McConnell refused to go for "the nuclear option" as it is known on Capitol Hill.//Republicans have argued that Mr Biden's voting legislation would impose questionable national standards on local elections.//Speaking after the president's speech, Republican Senator Mike Capo said the two bills were a "partisan, political power grab" and voiced opposition to changing Senate rules.//Jazmin Kay, 24, is a New York Democrat and the president of youth-voting advocacy group 18by.vote. She is glad to see the president talking about expanding voting access, but wants to see Congress pass legislation that would guarantee reform.//"We're frustrated with all the bureaucracy around voting rights," she says. "If we don't have comprehensive voting rights reform, then we're not able to have a say in what is done in our government. Enthusiasm is waning [among younger Americans]."//Ryan Doucette, 18, is an Ohio Republican and chief of staff to the young conservatives at Gen Z GOP. He warns that one-size-fits-all electoral reform by the federal government is "wildly misguided" and "rooted in cookie-cutter solutions".//"Democrats incorrectly say Republicans are systematically trying to disenfranchise voters of colour, while some outspoken Republicans falsely claim that elections are rife with fraud," he says. "Every community in America faces different voting rights challenges, and those should be addressed via sound policy for each distinct challenge."//Senate Democrats are planning to hold a debate in the next week on scrapping the filibuster. //But two centrist Democrats - Joe Manchin and Kyrsten Sinema - have indicated they will not go along.//Other Senate Democrats, including Arizona's Mark Kelly, Montana's Jon Tester and Delaware's Chris Coons - have suggested they are on the fence.//Republican-run states have introduced restrictions on access and verification since the 2020 election. They claim widespread voter fraud, though little concrete evidence has come to light.", 7.6%
