A White House official, who spoke on the condition of anonymity to discuss internal matters, defended Trump, saying “the President has hosted near 100 head of state/government visits since 2017” and only a fraction were at his own properties.


But, last year, Trump sought to award his own company a much bigger event: the massive Group of Seven summit, which Trump gave to his Doral golf club in Miami. That event would have brought hundreds of foreign and U.S. officials to that property. Trump reversed the decision days later, retreating under public pressure — and resistance from his own aides.
His visits brought another customer: The Secret Service.
When Trump visited Mar-a-Lago for two weeks at Christmas last year, for example, the club charged the Secret Service $32,400 for guest rooms.
In addition, Trump’s adult children have brought their father’s company another $260,000 in taxpayer revenue on their own, records show, by taking solo trips to Trump properties with their own Secret Service agents in tow.
And, in some cases, Trump’s properties even got paid on days when no Trumps were present at all.
New documents obtained under the Freedom of Information Act reveal the rates the Secret Service paid at President Trump's properties. (The Washington Post)
In Bedminster, N.J., for instance, Trump’s club has charged the Secret Service $17,000 per month to rent a cottage from May to November — even on days when the family is absent. That’s an unusually high rate for the area, but a former Trump administration official said they had to pay it — to be ready, if Trump suddenly decided to visit.
Defense Department records recently obtained by The Post show a similar pattern of $17,000 payments to Trump’s club in Bedminster in recent years. Pentagon officials declined to answer questions about whether they have a cottage there, too.
In the past, the Trump Organization has defended its actions with two arguments. One is that — even if it wanted to — it couldn’t do all this for free.
“Legally, by law, you have to charge the federal government something, otherwise you get into all sorts of gift laws,” Eric Trump told Fox News in February. Eric Trump has not specified what laws he is referring to.


Ethics experts said they were baffled by that claim, since the agencies that the Trump Organization is known to have charged the most — the departments of Homeland Security, State and Defense — all have policies allowing them to accept gifts under some circumstances.
“There’s nothing that would prohibit any government employee, including the president, from offering the government something for free” if those circumstances are met, said Don W. Fox, who was acting director of the U.S. Office of Government Ethics under President Barack Obama.
The Trump Organization’s second argument has been that — though it must charge the government something — it charges only enough to cover its costs. “If my father travels, they stay at our properties for free. Meaning, like, cost for housekeeping,” Eric Trump told Yahoo Finance last year. “If they were to go to a hotel across the street, they’d be charging them $500 a night, whereas, you know we charge them like 50 bucks.”
Among the hundreds of transactions reviewed by The Post, there were about two dozen payments that came close to that description: On three occasions when Trump visited his hotel in Las Vegas, for instance, the Defense Department reported paying just $74.51 per night for rooms. The Defense Department declined to comment about those payments.
But, in cases where The Post could determine what room rate was charged,  the Trump Organization mostly appeared to charge the maximum allowed under federal spending rules.
Or more.
At Mar-a-Lago, the government was charged rates ranging from $396.15 to $650 per room, according to documents obtained by The Post and people who have seen other, unredacted receipts. The rate for the cottage at Bedminster worked out to $566 per night. Once, when Donald Trump Jr. stopped at the Trump hotel in Vancouver, the Secret Service was charged $611 per night for his agents’ rooms. The Trump Organization has not commented on these higher charges.
Michael Cohen, Trump’s longtime “fixer” and attorney, said he saw no sign of a discount in those rates.
“That’s what anybody coming in would pay,” said Cohen, who worked at the Trump Organization through the beginning of Trump’s term. This year, he was released early from federal prison, after pleading guilty to campaign-finance violations and lying to Congress.


Campaign donors
Campaign donors
The use of campaign donations to pay Trump’s businesses is not new: During the 2016 race, his campaign paid them about $12.5 million. But that time, Trump put in far more money than he got out, contributing $66 million to his own campaign.
In the 2020 campaign, he’s done the opposite.
Trump has donated a mere $8,020 to his 2020 campaign as of Oct. 14, records show. But his campaign and affiliated fundraising committees paid at least $5.6 million out to his companies. The two committees spent nearly $1 million from Sept. 1 through Oct. 14, including $97,000 for lodging at Trump hotels and nearly $800,000 for catering and ballroom rentals, records show.
RNC and campaign officials have said Trump has never ordered them to visit his clubs — but it was understood that he is more likely to attend if an event is at one of his properties.
In those two months, Trump held five campaign events at his properties — including two in the same day. On Sept. 25, he held a “Latinos for Trump” event at his Doral resort in the morning and a fundraiser at his D.C. hotel in the evening.
Trump had planned another campaign event at his D.C. hotel, but it was canceled after he tested positive for the coronavirus. His campaign is expected to mark election night there next week.
Paul Seamus Ryan, of the nonprofit group Common Cause, said it was legal for candidates to rent things from their own business — as long as they appeared to be paying market rates and not overcharging.
But, Ryan said, he had never seen anyone do it at the scale Trump has.
“It’s extremely unusual. Unprecedented, in my experience — 20 years or so, watchdogging money in elections,” said Ryan, an election-law expert.
Trump’s campaign spends about $40,000 per month to rent office space in Trump Tower in Manhattan, which in 2016 served as its campaign headquarters. But this year, the campaign headquarters is not in Trump Tower. It’s in Arlington, Va. None of Trump’s key staff is in New York, and Trump no longer regularly visits there.


The Trump campaign and the Trump Organization both declined to answer questions on the record about what happens now in the Trump Tower space.
Trump’s campaign and joint fundraising committee have also paid $3.2 million to rent banquet space for fundraisers at Trump properties. Campaign officials have said this is a decision that pleases both Trump and his big donors, who feel at home inside Mar-a-Lago and the Trump hotel in Washington.
In recent months, something unexpected happened to Trump’s campaign — once called a “Death Star” by former campaign manager Brad Parscale. Several campaign officials have said they could use more money for television ads in the final stretch.
It started to run short of money. The campaign’s cash on hand shrank down to $43 million, far less than that of Democratic rival Joe Biden. That was surprisingly little for a campaign that started raising money far earlier than past incumbents seeking reelection: Trump’s 2020 campaign had been fundraising since before Trump took office in 2017.  The campaign has canceled TV ad buys in key states such as Wisconsin, Michigan and Ohio. In emails to prospective donors, Trump asked for money in capital letters.
“You’ve never let me down before and I know you won’t start now,” Trump wrote on Sept. 23. “Contribute ANY AMOUNT RIGHT NOW.”
The next day, Trump’s campaign paid Trump’s business $40,000 in rent, for that space in Trump Tower.










Joshua Partlow and Philip Bump contributed to this report.
On a Friday evening in late September, President Trump huddled with high-dollar donors, lobbyists and corporate executives in a private room at the hotel he owns in Washington, where attendees took turns pitching the president on their pet issues.
Trump was there to raise big money for his reelection effort. The price of admission: as much as $100,000 per person to get in the door.
For his guests, it was a chance to make the most of what has emerged as a signature feature of Trump’s Washington: the ability of wealthy donors to directly lobby the president.
One talked to him about solar panels; another about business loans, according to two people who participated and, like others interviewed for this report, spoke on the condition of anonymity to describe private interactions. At least one guest was told by Trump to follow up with White House Chief of Staff Mark Meadows, conveniently seated nearby.
 
One attendee’s plea on behalf of an obscure railway project in Alaska in need of federal approval appeared to get immediate results.
Just after midnight, mere hours after the campaign fundraiser, Trump tweeted that it was his “honor to inform you that I will be issuing a Presidential Permit for the A2A Cross-Border rail.”
“Congratulations to the people of Alaska & Canada!” he added, noting that the state’s congressional delegation was supportive of the move. The presidential permit was officially issued three days later.
Trump’s rapid action after the Sept. 25 fundraiser — one of dozens of high-dollar donor events he has headlined while in office — emblemizes how much he has abandoned his 2016 pledge to “DRAIN THE SWAMP.”
In the closing weeks of that election, Trump led cheering supporters in chants of that slogan, promising that he would completely disrupt the culture of Washington. He warned of the power of lobbyists and political donors who he said effectively bought off elected officials. He told voters he was uniquely prepared to take on the issue, because he knew personally as a contributor how the system worked.
 
“When you give, they do whatever the hell you want them to do,” he told the Wall Street Journal in 2015.
But during his four years in office, Trump has taken few steps to clean up Washington. He has instead presided over a norm-shattering expansion of private interests in government.


The government has had to spend money at Trump’s private hotels as his family has traveled around the globe.  Trump sidestepped rules that had been designed to prevent nepotism, allowing his son-in-law to serve in a top government role. He has touted companies run by supporters and allies who received government contracts.  His administration has allowed former lobbyists to serve in jobs in which they have oversight of policies that affect their former employers.
Among the five pledges Trump made to “drain the swamp” and curtail the influence of lobbyists in a major campaign speech in October 2016, a Washington Post review found that he sought to address only two, through an executive order in January 2017 — which contained a major loophole.
At a rally in Kinston, N.C., Oct. 26, 2016, then-presidential candidate Donald Trump said the phrase “drain the swamp” had been “trending all over the world.” (The Washington Post)
Craig Holman, a lobbyist for the government watchdog group Public Citizen, had initially expressed cautious optimism about Trump’s ethics pledge in 2017. He now says the president has worsened Washington’s profiteering culture in nearly every way.
 
“The whole administration has taken Trump’s tone — self-dealing, self-enriching, enriching your friends and families — that’s smart, if you listen to Trump,” he said.
Judd Deere, a White House spokesman, said in a statement that the president has followed through on his promises, casting “the swamp” as those who have opposed Trump’s agenda.
“President Trump has fought tirelessly in his effort to make Washington accountable to the American people — that can be seen not only in his government ethics reforms, but also in his push to drain the swamp of its tired, failed, recycled ideas, such as working to end endless wars, tearing up disastrous trade deals that shipped our jobs overseas, rolling back burdensome regulations and expediting permit approvals, and putting an end to uncontrolled immigration,” he said. “And that is why the Swamp has fought so hard against this President every step of the way.”
 
Rich contributors have long had access to elected officials in Washington, but as president, Trump has dropped any pretense that they should not be afforded special treatment.
Donors and others seeking access appear routinely at his private clubs in Florida and New Jersey, where they have buttonholed the president on the patio or golf course.
The ability of outside favor-seekers to influence Trump has at times worried administration officials. A group of Mar-a-Lago members sought to shape the direction of the Department of Veterans Affairs, as the former VA secretary detailed in a book. Donors attending fundraisers at his Bedminister club weighed in on the GOP tax bill, according to people familiar with internal discussions.


Meanwhile, lobbying firms that can claim access to Trump’s inner circle have thrived.
 
Barry Bennett, a 2016 Trump campaign adviser and lobbyist for foreign interests, said business for him was booming before the coronavirus pandemic.
The president’s attacks on the swamp have been effective in one way, he said: “To the extent that Washington is less popular, and people are more angry at their government, that’s been the effect of the Trump presidency.”
'I know the system'
'I know the system'
When Trump launched his presidential bid, he distinguished himself from rivals for the Republican nomination by saying he would fund his own campaign, eschewing the support of donors who he said corrupted the political system by seeking favors in exchange for their contributions. The argument proved powerful with voters.
“I will say this — [the] people [who] control special interests, lobbyists, donors, they make large contributions to politicians and they have total control over those politicians,” he said at a Republican primary debate in March 2016. “And frankly, I know the system better than anybody else and I’m the only one up here that’s going to be able to fix that system, because that system is wrong.”
 
He likewise termed super PACs, which can accept unlimited amounts of money, a “disaster.” “They’re a scam,” he said at a debate in October 2015. “They cause dishonesty.”
Trump unveiled the phrase “drain the swamp” in a speech in Green Bay, Wis., in October 2016, wielding it as a weapon against Democrat Hillary Clinton, who was benefiting from a network of wealthy donors that she and former president Bill Clinton had cultivated over four decades.
“There were a lot of Democrats that Trump may not have beaten with that message,” said Charles R. Black Jr., who has worked as a Republican lobbyist and consultant for nearly five decades. “The message worked — but it worked especially because of who she was.”
It was quickly a hit with Trump’s most enthusiastic supporters, entering the lexicon of call-and-response cries at his signature rallies. It remains one of the most popular chants and resonant messages, campaign aides say.
 
“We’re going to go to Washington. We’re going to drain the swamp,” Trump said at a North Carolina rally in 2016. As the crowd picked up the chant — “Drain the swamp! Drain the swamp!” — Trump explained that when he first heard the phrase, he hated it. He thought it was “hokey.” But then he said he noticed how crowds responded.
“The place went crazy,” he said, adding: “Now I love the expression. I think it was genius.”
By then, Trump’s original promises to use his own wealth to power his campaign had crumbled.
He ultimately reported spending $66 million of his own money on his winning campaign, only a small portion of the more than $564 million he raised by the end of 2016. By July 2016, he began appearing at fundraisers for a super PAC supporting his election.
Trump made no pretense of self-funding his 2020 campaign. Instead, he spent four years attending closed-door events for his wealthiest supporters, raising millions of dollars for his campaign and the America First super PAC.
 
Some of the country’s most powerful individuals have lent their properties for Trump’s gilded fundraising events, from the California hillside mega-mansion of Oracle founder Larry Ellison to the Hamptons beachfront palace of hedge fund manager John Paulson. The entry fee for some: as high as $580,600 a person, with much of the money flowing to the Republican National Committee, which as a party committee can accept large contributions. Many of the events are at Trump’s private clubs or hotels, where donors both contribute to his campaign and stay or dine at his properties.
Donors have gotten access not just to Trump at these events, but also to a range of senior Cabinet officials such as Labor Secretary Eugene Scalia, Interior Secretary David Bernhardt and Trump advisers such as Peter Navarro, Kellyanne Conway, Bill Stepien and Corey Lewandowski, invitations show.
Donor pitches
Donor pitches
While his predecessors typically kept their remarks at donor events short and scripted, Trump speaks loosely and profanely — even discussing sensitive military operations and vulgarly describing political foes.
“It’s like a rally speech, but with a lot more swearing,” one regular attendee said.
At a campaign fundraiser held Thursday at the JW Marriott in Nashville, one donor made a point of praising Trump for his work draining Washington’s swamp, according to an attendee.
“I had no idea how deep it was. I had no idea how mean it was,” Trump responded, speaking to a crowd of supporters who had paid as much as $250,000 to be in the room.
Among those in attendance at the Sept. 25 event at Trump’s hotel in Washington was Mead Treadwell, a former lieutenant governor of Alaska and vice chair of Alaska-Alberta Railway Development Corp., the company attempting to build a 1,600-mile railway to link a port in Anchorage to Canada. It requires federal approval because it would cross the border.
The project is still in its early phases, but company officials have said having the permit in hand will be key to raising additional money and moving forward.
Treadwell said he spoke to Trump at the event about the project’s potential benefits to Alaska. He said the company had lobbied for the White House to take over the approval process from the State Department, where it had previously resided. The White House agreed in February and the issue was fully briefed for White House lawyers five or six months ago, he said. Then the company waited.
Treadwell attended as a guest of the fiancee of the railway company’s chairman, he said. He said his comments were brief, thanking Trump for considering the project — and the White House for taking it over.
Treadwell noted that Alaska’s governor and congressional delegation back the project and had been lobbying the White House for the approval, and that he believed their input was what probably spurred the president.
Sen. Dan Sullivan (R-Alaska) also spoke to Trump on the day of the fundraiser, presenting a one-page memo explaining the proposal and telling the president that the rest of the delegation supported it, according to a person with knowledge of their conversation. Sullivan did not respond to a request for comment.
Still, Treadwell said, the tweet was surprising.
“I can’t tell you how or why the White House made the decision when they did,” he said. “All I can say is, we’ve had a long series of consultations on this.”
He added: “I don’t think there was any quid pro quo.”
A White House official said the project has state support, the permit had already gone through a review process and its approval was unrelated to the fundraiser.


The ability of high-dollar donors to shape Trump’s views was put into sharp relief earlier this year, when onetime Trump supporter Lev Parnas released recordings of events.
In the recordings, one donor could be heard proposing the president hold a summit meeting with Kim Jong Un, the leader of North Korea, at a South Korean golf course he owned. Another donor, who owns a Canadian steel company, pushed Trump to limit steel imports to the United States.
Parnas and his business partner Igor Fruman, who were working with Trump lawyer Rudolph W. Giuliani, urged the president to recall the U.S. ambassador to Ukraine, whom they viewed as unfriendly to interests of a new natural gas company they had formed.
“Get rid of her! Get her out tomorrow. I don’t care. Get her out tomorrow,” Trump could be heard immediately instructing an aide after the two made the request.


Parnas, now a sharp critic of Trump, has been charged with campaign finance violations and defrauding investors in his company. He has denied wrongdoing. Parnas said it was widely understood by donors that they were paying for face time with Trump.
“Everyone knew that about Trump — all it took was that one minute, if he liked it,” he said. “It was okay to spend a million dollars on a dinner. Because that dinner could make your whole life.”
A lobbying loophole
A lobbying loophole
It was eight days after Trump’s inauguration, and he was sitting in the Oval Office surrounded by top aides such as then-White House Chief of Staff Reince Priebus, issuing one of his first executive orders. The presidential directive addressed one of his major “drain the swamp” planks: a promise to curb lobbyists.
“Most of the people standing behind me will not be able to go to work” after they leave government, Trump said.
The order addressed one of his campaign promises when it came to lobbying: It required senior executive branch officials to sign a pledge that they will never in their lifetime work as registered foreign lobbyists.
But when it came to lobbying overall, the order had a loophole: It prohibited former executive branch appointees only from lobbying the agencies where they had served, not the government overall.
Overall, Trump has largely failed to fulfill the pledges he made in his Green Bay “drain the swamp” speech. He had promised he would push Congress to pass a five-year lobbying ban into law so it could not be lifted by a future president. But he never proposed such legislation. Nor did he ask Congress to impose a similar five-year lobbying ban on its members, as he had promised he would in 2016.
In addition, he never tried to seek to “close all the loopholes” used by former government officials who get around registering as lobbyists by calling themselves “consultants” and “advisers.” And he never acted on his pledge to stop foreign lobbyists from campaign fundraising — and in fact, has benefited from their financial support.
As his promises to curtail lobbying have faded, Trump allies who can offer insight to private interests have flourished.
“People who know how Washington and the administration works, those people are always going to be valuable,” Bennett said.
Priebus, for example, has been paid up to six figures for private speeches to describe Trump’s decision-making process, according to people with knowledge of the speeches. Priebus declined to comment.
Other Trump allies have worked as traditional lobbyists.
Take David Urban, a Trump campaign adviser in 2016 and 2020, who has counseled the president on senior personnel matters and politics, often in weekend phone calls, and has regularly flown on Air Force One.
His lobbying clientele in the Trump era has included a range of companies with interests before the government, including the weapons giant Raytheon, T-Mobile and ByteDance, the parent company of mobile app TikTok, which was targeted by the Trump administration.
Urban did not respond to requests for comment. He recently went to work for ByteDance full time.
Former New Jersey governor Chris Christie, a longtime adviser who served as Trump’s coach before this fall’s presidential debates, has earned nearly $200,000 lobbying for the Puerto Rican power authority this year, as well as for health systems that were seeking coronavirus-related government funding and a shipping conglomerate, according to lobbying records.
Trump has long railed against Puerto Rico but decided earlier this year to grant the territory nearly $13 billion in aid.
In an interview, Christie said he had only personally lobbied the president once — on behalf of a legal client, who was given a pardon last year. He said he had never lobbied the president for business clients but deals with White House and agency officials.
Christie said he had “no idea” if his advocacy on Puerto Rico led Trump to agree and grant the country aid this fall, partially for the grid:  “He has never told me that directly.”
Backed by foreign lobbyists
Backed by foreign lobbyists


Perhaps one of the most successful figures in the Trump lobbying era has been Brian Ballard, who got his start with Trump lobbying for his company in Florida.
In the past four years, he has lobbied the federal government on behalf of dozens of clients, including private prison company Geo Group, which in 2017 moved its annual leadership conference to a Trump-owned property, as well as Uber and Amazon, public records show.
