President Trump’s original entry ban on visitors from seven Muslim-majority nations, issued the week he took office in 2017, became a model for his use of executive power: aggressive, highly politicized and sometimes a bit sloppy.
The order was a hasty attempt to address Trump’s impossible campaign promise of a “total and complete shutdown of Muslims entering the United States.” It prompted global condemnation and cries of racism from critics. And it was revised twice under legal challenges before passing muster with a divided Supreme Court.
Through scores of executive orders and other directives since then, Trump has sought to highlight conservative policy priorities including an immigration crackdown, his still-unfinished border wall, reductions in environmental protections and boosts for domestic energy production.
 
One of his most expansive moves came last week with an executive order that would remove job security for tens of thousands of civil servants, marking a dramatic effort to remake the nonpartisan side of the federal government.
Trump has also frequently used the power to appeal to his largely White political base by stoking racial and cultural divisions, academics and others who track executive orders said.
“I’ve also issued an executive order to prohibit the teaching of critical race theory in the federal government,” Trump said to applause during a reelection rally in Muskegon, Mich., this month, referring to a directive attempting to restrict certain kinds of diversity training.
“Oh, you’re so lucky that I’m your president, because that was getting out of hand,” Trump added.
Trump’s 193 orders to date exceed the numbers for other recent presidents: Barack Obama published 147 executive orders in his first term, George W. Bush 171 and Bill Clinton 128. But presidential scholars said the most notable difference is Trump’s eagerness to embrace a tool that most presidents have treated more as a last resort — stretching the boundaries of executive authority in ways likely to outlast him, whether through policies that endure or greater leeway for future presidents to deploy executive power.


“I think he likes the phrase ‘executive order,’ ” said Bowdoin College political science professor Andrew Rudalevige, who along with three other academics has compared Trump’s use of the tool to other recent presidents’.
 
“It’s better to ‘order’ something rather than ‘memoranda’ something or ‘guidance’ something,” Rudalevige said, noting that the Trump White House brands routine statements as executive orders, apparently for theatrical and political effect. “He sure likes having something to sign and hold up” for news cameras.
Trump’s orders follow the broad pattern of recent predecessors who have used the power chiefly to address matters of government organization and operations, foreign policy, defense and national security, the analysis by Rudalevige and his colleagues found.
But Trump’s orders stand out in both style and substance. Their populist flair, showmanship and hyperbole echo the president’s public speaking style, and recent orders have come with lengthy, sometimes first-person preambles boasting of Trump’s accomplishments in office.
 
“The end goal of these does not always seem to be the specific policy goal these orders are crafted around, but instead are a way of giving the president a thing he can point to as a thing he has done. Something affirmative,” said Liz Hempowicz, public policy director at the nonprofit Project on Government Oversight.
Despite facing numerous court challenges, beginning with the entry ban, Trump has also successfully expanded presidential power in part by classifying immigration and some environmental and other issues as matters of national security.
“He’s really pushed the envelope on what a president can do. In some cases that has been a successful means of expanding the power of the office, and in other cases he’s been slapped around by the courts a little bit,” said John Hudak, deputy director of the Center for Effective Public Management at the Brookings Institution.
 
Trump appears untroubled by a concern among some previous presidents about overuse or misuse of executive orders, held “because of an understanding of the office and that losing in court can weaken the presidency,” Hudak said.
The White House says Trump has used his executive powers on behalf of the country.
“While President Trump prefers to work with Congress to deliver results for the American people, as he did to pass historic criminal justice reform through the First Step Act, momentous tax cuts through the Tax Cuts and Jobs Act, and coronavirus relief through the Cares Act; he has also achieved more than any president in history by frequently utilizing his executive authority when Congress has played politics instead of doing what’s right for the American people,” deputy press secretary Judd Deere said in a statement.


Deere added: “President Trump has signed executive orders to reinvigorate our space program, expedite critical infrastructure projects across the country, promote agricultural prosperity, reduce regulations on affordable housing, confront online censorship and suppression of free speech, mobilize American manufacturing to produce necessary medical supplies during a global pandemic, end surprise billing for health-care expenses, lower the price of insulin and prescription drugs, encourage buy-American and hire-American practices, and implement hundreds of other actions to improve the lives of all Americans.”
 
Democratic presidential nominee Joe Biden has pointed to several areas, including on immigration policy, where he promises to undo or revise Trump’s actions if he wins next week. Some of those revisions would be likely to use executive orders.
“Vice President Biden will take immediate action — through legislation and executive action — on a host of issues,” Biden campaign press secretary T.J. Ducklo said.
Trump’s pace of executive orders has accelerated this year, partly in response to the coronavirus pandemic that has killed more than 225,000 Americans, with 56 orders issued through last week. The only president of modern times who has exceeded Trump in the use of such orders was Ronald Reagan, who issued 211 during his first term nearly four decades ago.
Trump also revoked more executive orders in his first year than Obama, but fewer than Bush, Clinton or Reagan, the analysis by Rudalevige and others concluded.
 
Executive orders and related forms of presidential directives address government operations. They are issued independent of Congress, offering a president stymied by the legislature or choosing to move faster than the speed of lawmaking a way to get things done.
Their use or overuse has been controversial for decades, with both political parties at times decrying the rise of an “imperial presidency” that aggregates power to the executive at the expense of Congress or the courts. The other branches of government can each be a check on executive action, with courts able to strike down orders and Congress able to pass laws that make a given order impossible to enforce. Only a president can revoke an order.
Conservatives, including Attorney General William P. Barr, have argued that presidents have been denied the full measure of their constitutional authority, and some have looked to executive orders as a way to project the power of a strong executive branch.
 
Heritage Foundation vice president James Carafano, a conservative foreign policy expert with ties to the Trump White House, said criticism of executive orders as an arrogation of power misses the point. Presidents have always had power to issue unilateral directives to the government but may not have labeled their actions as executive orders, he said.
“There’s this mythology that’s grown up around executive orders,” including an expectation that a new president will have a batch ready to go on Day 1, Carafano said.
“Obama did some of that, and Trump took it to a new level,” Carafano said. “It’s not that presidents are becoming more activist, but — I hate to say this — it’s kind of a PR thing. The power of the presidency is exactly the same.”
Trump’s approach to the power is an implicit rejection of the view that executive orders are a president’s last resort or a sign of weakness because the desired policy outcome could not be achieved through legislation.
 
In his second term, Obama began saying “I’ve got a pen, and I’ve got a phone,” as an answer to why he used such orders in response to a deadlocked Congress. Among his most far-reaching actions were a group of orders protecting undocumented immigrants brought to the country as children, known as “dreamers,” from deportation. The Supreme Court blocked the Trump administration from ending the program earlier this year.
As a candidate in 2016, Trump had criticized Obama for taking “the easy way out,” and said if elected he wanted “to do away with executive orders for the most part.”
But Trump opted for executive actions from the very start of his presidency, when he enjoyed a Republican majority in both houses of Congress, and hasn’t looked back.
In January 2017, scenes of sorrow and chaos ensued around the world as travelers, airlines, diplomats, federal agents and lawyers tried to make sense of Trump’s executive action against migrants and U.S. legal residents from Iraq, Iran, Sudan, Somalia, Syria, Libya and Yemen, and to refugees from around the world. The list of countries would later shift with changes under court challenges.


“For people who follow executive orders, the thing that was immediately obvious was that this order was not really very — well, let’s say it didn’t show the kind of careful drafting that has been typical” for White House issuances meant to stand up in court, said John Woolley, professor emeritus at the University of California at Santa Barbara, who co-directs a project that catalogues presidential orders.
But, he added, “it was a bold, dramatic stroke implementing a kind of campaign promise. That’s not an indicator of somebody who’s really trying to achieve consequences. It’s symbolism, and I think a lot of Trump’s ordering has that kind of symbolic quality to it.”
The approach has become almost reflexive, Woolley and other experts said.
Trump’s orders have ranged from banal to brazen, on such matters as creating a National Space Council in 2017 and “Advancing American Kidney Health” in 2019.
One directive earlier this month called for a report and recommendations “to support integrated planning and coordination among agencies to maintain and modernize our Nation’s water infrastructure, including for drinking water, desalination, water reuse, wastewater, irrigation, flood control, transportation on our rivers and inland waterways, and water storage and conveyance.”
That one did not arrive with the fanfare of a Sept. 24 order bearing the misleading title “An America-First Heathcare Plan.” The order was not the comprehensive health-care plan Trump has repeatedly promised and failed to deliver, but he made a show of signing the document during an event in North Carolina, a 2020 swing state. He sat at a plain wooden desk that looked much too small for his frame, then held up the signed order for the cameras.
In another recent example, The Washington Post reported in September that Trump had issued a verbal directive after watching a Fox News report about diversity training in the federal government, which he labeled “crap.” Training sessions were ordered halted, but the White House had to issue further clarifications amid weeks of confusion.
In many cases, the president has used his reversals as rallying cries to his political base or to appeal to the wider Republican preference for rolling back regulations.
Speaking Sunday in Maine, Trump celebrated his proclamation in June opening the Atlantic Ocean’s only fully protected marine sanctuary to commercial fishing. The move lifted 2016 restrictions imposed by the Obama administration on nearly 5,000 square miles of ocean to save whales and allow marine life to recover from overfishing.
“So I don’t know if you know, they took 5,000 square — they called it a monument. You know who it was a monument to? Your last president. And I got rid of it,” Trump said. “I did it through an executive order. I freed it up, so now you can have that — all of that tremendous ocean back.”


President Trump has at times spoken favorably of immigrants during the past four years, echoing conventional Republican praises for those who arrive in the United States legally. But in his less scripted moments, like at a rally in Minnesota in late September, Trump’s words fully align with the policies he has put in place, and something electric happens between the president and his supporters.
The event took place as the Trump administration prepared to cut the number of refugees eligible for admission into the country to 15,000, the lowest level since 1980. The president told the audience that his Democratic rival, Joe Biden, would reverse that and “turn Minnesota into a refugee camp.”
President Trump on Sept. 30 criticized Rep. Ilhan Omar (D-Minn.), who came to the U.S. as a Somali refugee, for telling “us how to run our country.” (The Washington Post)
The crowd hissed and booed. The president stood basking in the sound, a throng of Americans jeering at immigrants who seek shelter in the United States legally, fleeing religious persecution, torture, genocide.
U.S. presidents have not always spoken this way about people hoping to reach safety, and their dreams, in America. But Trump’s first term has shattered the decades-long bipartisan view of immigrants as a pillar of the nation’s identity. During the past four years, his administration has issued scores of proclamations, regulatory changes, legal decisions and executive orders seeking to reshape immigration policy. A July report from the Migration Policy Institute, a nonpartisan research organization, put the number at more than 400.
 
The measures have been large and small, sweeping and narrow, legal and physical.
Trump has ordered border agents to separate migrant children from their parents, has cut work visas for foreign software engineers and has erected giant steel barricades across hundreds of miles of borderlands. The changes have been dizzying in their scope and frequency, but they follow a singular logic: to make the United States a more closed, restrictive nation. To wall it all off.
“He’s done what he said he’d do,” Ken Cuccinelli, the second-ranking official at the Department of Homeland Security, said in an interview defending Trump’s record as a wide-ranging, comprehensive effort to “make sure Americans come first.”
“I can’t think of another policy area where he’s encountered more hurdles, and he’s pressed ahead successfully,” Cuccinelli said.
 
The number of U.S. immigrant visas issued overseas fell 25 percent from 2016 to 2019, State Department data shows. The overall growth of the country’s immigrant population slowed to about 200,000 per year during Trump’s first two years, down from 650,000 per year under President Barack Obama, according to an analysis of U.S. Census Bureau survey data by the Center for Immigration Studies, a Washington think tank that saw its restrictionist proposals going from the fringes of the Republican Party into the halls of the West Wing.
The net results of Trump’s efforts have in other ways fallen short of his rhetoric. Trump took office promising millions of rapid deportations, but his first-term deportation numbers are below that of Obama’s. Trump repeatedly threatened to “close” the Mexico border, but he presided over the biggest migration crisis in a generation, as a record surge of families overwhelmed U.S. agents and led to nearly 1 million arrests in 2019.
Trump’s chaotic management style fostered instability and frequent turnover at the Department of Homeland Security. His shift from a focus on counterterrorism to immigration enforcement alienated career officials and damaged the bipartisan support the department has counted on since its creation in the wake of the Sept. 11, 2001, attacks.
In Washington, Mich., on Nov. 1, President Trump laughed at the idea of refugees facing Michigan's cold. The refugee cap is at its lowest number ever. (The Washington Post)
The Nov. 3 election presents voters with two sharply divergent policy agendas: Biden has said he will repudiate and reverse Trump’s immigration measures, and the president’s reelection almost certainly would lead to an expansion of his first-term agenda.
 
“Trump has laid the foundations for a permanent shift in the immigration system of the United States,” said Andrew Selee, president of the Migration Policy Institute. “But that so many of these measures have come through administrative rulemaking and processes means they are subject to be reversed if Trump doesn’t continue in office.”
Trump’s vision for a wall across the entire 2,000-mile border with Mexico remains unrealized. But he has completed nearly 400 miles of steel barriers through remote deserts and mountains — U.S. taxpayers have footed the entire bill, not Mexico, as he promised —  using funds primarily diverted from the U.S. military budget.
The $15 billion Trump wall, one of the costliest federal infrastructure projects in U.S. history, has been installed primarily on remote public lands in the Southwest, not the Rio Grande segments in Texas that were the top priority for U.S. border officials. And despite the huge investment, border arrests rose last month to their highest level for any September since 2006.
 
The president’s supporters say he has changed the immigration debate in the United States. His critics do not disagree, saying he welcomed racism and xenophobia into the open and stigmatized outsiders to create a new, angry American identity.
No figure has been more responsible for steering Trump along that path than senior policy adviser Stephen Miller, a singular, implacable force on the issue.


Miller, one of the president’s longest-serving and most trusted aides, developed a reputation for reaching deep into federal agencies to have regulations changed, crafting executive orders that others in the building barely understood before the president signed them. Sometimes people would ask Miller to go through regular protocol, but “there was nothing you could really do because he had the president’s support,” said a former senior official who worked closely with him.
 
In an interview, Miller said confidently that Trump has done more on immigration in four years “than any president in history.”
“The president has delivered for the working people of this country whose voices have been neglected for decades,” he said. “The policies, procedures and programs he put in place will endure for a long time to come.”
While some former Trump officials have expressed contrition for the administration’s treatment of immigrants, Miller said he has no regret for Trump’s first-term moves, blaming a backlash against his immigration agenda on unfair media coverage. He accepted no responsibility for a coarsening public debate in which foreign-language speakers are berated in public and violent white supremacist groups have thrived.
In recent weeks, Miller has campaigned for the president by evoking the imagery of a foreign “invasion” that has been a stock feature of right-wing nationalism.
 
“If the left gains power, and revokes the border controls now in effect, it will unleash a global tsunami of illegal immigration unlike anything the world has ever seen before,” Miller said.
The Trump administration has cited the public health threat from the novel coronavirus to implement the kind of severe border and immigration restrictions the president, and Miller, have long extolled. With U.S. consulates closed abroad, the number of immigrant visas has plunged 90 percent since March. U.S. agents at the border have emergency authorities to summarily “expel” most migrants back to Mexico. The country is essentially closed to asylum seekers and refugees.
John Kelly, the former chief of staff and DHS secretary when some of Trump’s harshest policies were hatched, said there was a significant missed opportunity in the presidency to have a more sensible — and broader — conversation about immigration.
 
“We need to have a discussion about immigration in terms of who should come here and how many immigrants should come here,” Kelly said in an interview. “We’ve lost out on having that discussion, unfortunately, because of the hard-liners.”
Trump has not significantly reduced the number of immigrants living in the United States overall. The share of the U.S. population that is foreign-born — about 14 percent —  remains at its highest level since 1910. Though the president repeatedly urged an overhaul of the legal immigration system to favor skilled immigrants over family ties, the White House failed to secure passage of such legislation before Republicans lost control of the House in 2018.
What changed in the United States, for many of the roughly 45 million U.S. residents who are foreign-born, is the way the country talks about immigrants and how it treats them. The president gave “a green light to hate,” said Selena Besirevic, who arrived in 1995 at age 13 as a Bosnian refugee.
“This administration didn’t create hatred in people’s hearts, it just empowered it,” said Besirevic, now an attorney in Denver. “I think the racism and discrimination have always been there in some people, but they knew it wasn’t acceptable. Now they’re thinking: If my president is saying it, so can I. And if the government is treating immigrants horribly, I can, too.”


Cascading changes
Cascading changes
Trump’s immigration policies began with a fusillade in his first days in office, launching orders to expand immigration enforcement, tighten border security and impose a travel ban that predominantly affected citizens of several Muslim-majority nations. Thousands of people protested as refugees and travelers were stranded overseas.
 
“From the very first moment,” said Oscar Chacón, executive director of Alianza Americas, an advocacy network of migrant-led groups, “our nightmare began.”
On the campaign trail in 2016, Trump promised to deport millions of “bad hombres,” and soon after his election, detention centers filled with more than 50,000 immigrants a day, a historic high. Trump’s top immigration enforcement official warned that the 11 million undocumented immigrants living in the United States “should be afraid.”
“The language is one of the worst aspects,” said Chacón, a naturalized citizen who fled the war in El Salvador, noting that the administration has used “fearmongering” to build public support for its policies. “They have used language to further dehumanize, criminalize, so that the public can say it’s okay.”
The Trump presidency’s focus on the border — both with policy and with his wall — made more evident than ever that migration trends respond to perceived changes in enforcement and even presidential rhetoric.
Border crossings fell immediately after Trump took office, reaching their lowest level in decades but then began to tick upward as smuggling organizations realized nothing changed.
The Trump administration responded to the surge in the number of parents bringing children to the U.S. border by announcing a “zero tolerance” policy — with the immediate effect of separating parents from their children upon entry. Trump caved after six weeks amid a massive public outcry, but his directive to keep families together was soon twisted by smuggling guides in Central America as a sales pitch that offered discounts to migrants who brought children, claiming they were the ticket to avoiding U.S. detention and deportation.
Trump used multiple measures to break the migration surge, pressuring the Mexican government to deploy troops and allow the United States to send Central Americans back over the border into Mexico to await U.S. court dates there. Squalid camps of asylum seekers sprouted on the banks of the Rio Grande.
Kevin McAleenan, who ran U.S. Customs and Border Protection from 2017 to 2019 and then served as acting Homeland Security secretary during the migration crisis, said the episode showed a need for a much deeper commitment to Central America.
“The last several years have demonstrated that it’s not just development aid or security support,” McAleenan said. “While those efforts are fundamental, we must engage Central American governments directly on regional migration flows, and work with them to address the human smuggling organizations, while extending protections for vulnerable populations closer to home.”
Biden, if elected, may not be able to easily deliver on his pledges to roll back Trump’s immigration legacy. Miller and his team created interlocking layers of measures to restrict access to the U.S. asylum system, for instance, so an unfavorable court ruling or injunction blocking one measure would leave others intact. He flooded the immigration system with so many regulatory changes and executive actions that advocacy groups struggled to keep pace in court.


Some of the immigration restrictionists who back Trump have urged him to run more aggressively on his record, dismayed that the issue has been less central to his reelection than during the 2016 campaign.
