But she refused to sign a declaration about the book prepared by administration lawyers that she believed to be incomplete and misleading, her attorney, Ken Wainstein, said in a letter filed in a federal court case about Bolton’s book.
After concluding her review, Knight was instructed by a White House lawyer to tell Bolton that the coronavirus pandemic had delayed final approval.
Only later did she learn that a White House lawyer with little or no experience with pre-publication reviews had taken the unprecedented step of starting a second review that contradicted Knight’s scrub of the document. Knight questioned the politicization of the process.
At one point, Wainstein said in the letter, Knight asked White House officials “how it could be appropriate that a designedly apolitical process had been commandeered by political appointees for a seemingly political purpose.”
In August, Knight was notified that she would immediately be reassigned to the National Archives, despite previous assurances that she would be permanently hired at the NSC. A spokesman for the NSC declined to comment.
John P. Fitzpatrick, the senior executive who recruited Knight to the White House in 2018 and retired last year, called her sidelining a painful symbol of the toll the agency has suffered during the Trump era, a time of record turnover.
“She is the type of person that anyone would want on their staff,” Fitzpatrick said.
Fitzpatrick said there were so many abrupt dismissals of well-regarded personnel in the Trump era that the NSC’s human resources staff had to develop a special protocol to deal with exiting personnel, their clearances and reclaiming classified material.
Diplomatic corps
Diplomatic corps
The State Department became another powder keg, a revered agency turned on its end as two controversial leaders slashed its budget and brought on the smallest number of new Foreign Service officers in a generation.
An anxious mood pervaded the Harry Truman Building in Foggy Bottom soon after Trump took office and issued an executive order barring travelers from seven Muslim-majority countries. More than 1,000 U.S. diplomats criticized the policy in an official dissent cable, a previously acceptable outlet for disagreement that became the first of many loyalty tests.
Diplomats were sidelined and excluded from senior jobs in Washington. Returning ambassadors were reassigned to process public records requests. An exodus depleted the ranks of high-ranking Foreign Service officers and civil servants. For the first time in more than a century, all assistant-secretary slots are filled by acting heads or political appointees.


Overseas, Trump has stocked the ambassador corps with an irregular number of political appointees, hitting 57 percent last year, well above the 30 percent common in most administrations.
“The disillusionment is not going to just be fixed by Joe Biden if he wins,” said Eric Rubin, a former ambassador and president of the American Foreign Service Association, a union that represents Foreign Service officers.
The association has proposed that Foreign Service officers and civil servants who left be allowed to return at their former grade, “because we’re going to have such a challenge building back,” Rubin said.
For every public servant who left is someone who decided to stick it out, careful not to attract attention.
That is what happened at the Energy Department’s Office of Energy Efficiency and Renewable Energy, which was tasked by political appointees this year with carrying out a presidential whim as the election neared.
It was an appeal to suburban women. Trump issued a barrage of complaints at campaign rallies about the allegedly declining performance of dishwashers, shower heads, toilets and lightbulbs he said made him look orange. He blamed government efficiency standards.
The standards had been in place for years, and there was no groundswell of complaints from the industry. But the engineers and analysts put aside other priorities. The political appointees dictated that they approve a new class of dishwasher that cycles in less than an hour and change the existing shower-head rule to allow multiple nozzles at a time — and a bigger blast of water.
“We can resist for only so long,” said one official who was not authorized to speak publicly and commented on the condition of anonymity.
The White House fast-tracked the new regulations. They were far enough along that Trump would brag at a campaign rally in Nevada last week that his administration had made sure shower heads and dishwashers gave powerful blasts of water, regardless of the extra energy use. It would be like the old days.
The dishwasher rule was finalized last week. Environmental groups are gearing up for a lawsuit. The shower-head rule could still make it across the finish line — or be killed by a new administration in Washington.








Andrew Ba Tran and Alice Crites contributed to this report.
Correction: An earlier version of this report understated the increase in complaints to the Office of Special Counsel over the past four fiscal years. They are up 36 percent from Obama’s first term, not 26 percent.
President Trump’s first-term record on the federal judiciary — which reached its apex Monday with the confirmation of Amy Coney Barrett as his third Supreme Court justice — will be difficult to roll back even if Democrats win both the White House and the Senate majority.
But the pipeline of conservative judges and the fast-track procedures Republicans have used to confirm them give a potential President Joe Biden and a Democratic-led Senate a rough playbook to try to install their own stream of liberal nominees.
The judicial legacy set by Trump but engineered primarily by Senate Majority Leader Mitch McConnell (R-Ky.) includes several significant milestones, including the trio on the Supreme Court and the fact that for the first time in 40 years, there were no openings on the circuit courts. That has been a monumental achievement for a majority leader whose mantra has been “leave no vacancy behind” and for a president who simply likes to win.
 
“I have three Supreme Court justices. I have a great one coming,” Trump said Saturday at a campaign rally in Circleville, Ohio. Inflating the total number of judges confirmed under his tenure, the president added: “Think of that, 300 federal judges, I think close to 60 court of appeals judges and three Supreme Court justices. I mean — can you believe it? Even I can’t believe it!”
Barrett, 48, was confirmed with Republican-only votes Monday night, cementing a 6-to-3 conservative majority on the Supreme Court. She will be the 220th federal judge confirmed under the Trump presidency and the McConnell-led Senate — a figure that includes not only her and Justices Neil M. Gorsuch and Brett M. Kavanaugh, but also 53 circuit court judges, 162 district court judges and two to the U.S. Court of International Trade.
For the first time in more than four decades, there were no vacancies on the circuit court level, where approximately 30 percent of those sitting on the bench have been nominated by Trump. (That changed Monday with the death of Judge Juan R. Torruella of the U.S. Court of Appeals for the 1st Circuit, who was nominated by President Ronald Reagan.) Only President Jimmy Carter had more circuit court judges, as well as a larger share of the entire federal appellate bench, confirmed in his first term, and that was before the number of seats in the circuit courts was expanded.
Some Democrats have called for expanding the number of justices to the Supreme Court in order to shift its ideological leaning. (The Washington Post)
Since 2017, McConnell and Senate Republicans have prioritized filling vacancies on the Supreme Court and the circuit courts, where the vast majority of cases on a litany of matters, including health care, the environment and government regulations, are settled.
 
“We do a lot of stuff here that is small ball, but this is something that may last 25 or 30 years,” said Sen. John Cornyn (R-Tex.), one of the majority leader’s closest allies. “I give Senator McConnell a lot of credit for keeping us focused on it.”
Few issues have energized and united the Republican base more than the issue of the judiciary, and it has been a decades-long project of the right to steadily fill seats on the federal bench with reliable conservatives. Once viewed skeptically by traditional GOP voters, Trump released a list of potential Supreme Court nominees during his campaign in 2016, a move that reassured conservatives while a seat on the court was vacant.
Still, public polling has started to show a shift in which party cares more about the judiciary. A Pew Research Center poll in August found that 66 percent of registered voters who supported Biden said the matter of Supreme Court appointments was “very important” in considering their vote for president, compared with 61 percent of Trump backers.
 
That same question in 2016 drew the reverse response, with 70 percent of Trump’s supporters saying the issue was “very important,” while 62 percent of backers of Democrat Hillary Clinton said the same.
To reach their judicial goals, Republicans and the White House revised Senate rules and reversed key practices used by their Democratic predecessors in evaluating nominees — traditions that some Senate Democrats have said they should similarly disregard if they take control of the Senate.
Two of the most significant changes involve floor deliberations. During Gorsuch’s nomination fight in 2017, Senate Republicans invoked the “nuclear option” to change rules for Supreme Court nominees so that they no longer needed 60 senators to advance to a final confirmation vote. That effectively finished the task Senate Democrats began in 2013, when they deployed the same maneuver to change confirmation rules for all executive branch picks and nearly all judicial nominees.
 
In 2019, Senate Republicans changed the rules to significantly trim the time available for floor debate for district court judges. Before the change, nominations could be debated for a total of 30 hours before a confirmation vote, but GOP senators slashed that to two hours for all nominees except those to the Cabinet, the Supreme Court, the circuit courts and some independent boards.
A Biden White House and a Democratic-controlled Senate could certainly take advantage of the floor changes by being able to confirm Supreme Court picks with a simple majority and process district court nominees more quickly on the floor, should they prioritize the judiciary.
There are other practices generally used by the previous Democratic-led Senate that Republicans have neglected. They include the “blue slip” tradition for circuit court nominees — which effectively gave a state senator veto power over judicial picks from his or her state.
 
Democrats also complained when the Senate Judiciary Committee in the past four years — first under Sen. Charles E. Grassley (R-Iowa) and now Sen. Lindsey O. Graham (R-S.C.) — questioned multiple circuit court nominees at the same confirmation hearing, which Democrats said offered less time for senators to vet each one individually. Republicans said previous committee leaders, including Democrats, have held hearings featuring more than one circuit court nominee.
Meanwhile, at the Trump White House, the counsel’s office has declined to allow the American Bar Association to review potential candidates before they are formally nominated. That was the process used by the Obama White House — which helped weed out “not qualified” candidates before their names were made public — but the Trump administration returned to the process followed under President George W. Bush, which allowed for American Bar Association evaluations after people were nominated.
There has been no clamoring from Democrats to return to many of these practices. Sen. Dianne Feinstein (D-Calif.), who would be in line to be Judiciary Committee chairwoman under Democratic control, has not publicly committed to any particular policy for processing nominees if she ran the panel.
 
Other senators on the Judiciary Committee aren’t as gun-shy, a reflection of the acrimony after years of partisan fighting in the judicial wars.
“No,” said Sen. Mazie Hirono (D-Hawaii), when asked whether Democrats should offer deference to Republican home-state senators if they do not sign off on circuit court nominees from a Biden administration. “The rules have changed. Do I look stupid to you?”
Sen. Richard Blumenthal (D-Conn.), another Judiciary Committee member, also stressed that he believes Democrats “ought to play complete hardball” on judges.
“The question is whether we should allow states where there are two Republican senators to dictate who the judge here should be. I would say no,” Blumenthal said.
Still, some other Democrats are more cautious at this point about embracing some of those practices.
 
Sen. Christopher A. Coons (D-Del.) said he would have to think about whether he would support reinstating the blue-slip practice for circuit court nominees. Coons, perhaps Biden’s closest ally in the Senate, also noted that the American Bar Association has “long played an important role of providing an early warning” about unqualified picks.
“We need to have a focused, deliberate conversation about which are the features of the confirmation process from before that are constructive, appropriate, necessary and we want to restore, and which are the features that, frankly, given they’ve been broken, we’re not going to reinstate them,” Coons said.
Those are arcane, yet critical, process decisions that Democrats may have to make soon.
About 30 circuit court judges nominated by Democratic presidents may be eligible to take senior status — a kind of semiretirement — but have not chosen to do so, according to Russell Wheeler, a fellow at the Brookings Institution who is an expert on the federal judiciary. (One seat on the U.S. Court of Appeals for the 7th Circuit opened up with Barrett’s confirmation, although the Trump White House has already nominated her replacement.)
Trump’s influence on the circuit courts is already deeply felt. He and Senate Republicans have turned three federal appeals courts once dominated by Democratic-appointed judges — the U.S. Court of Appeals for the 2nd Circuit, based in New York; the 3rd Circuit, based in Philadelphia; and the 11th Circuit, based in Atlanta — into courts with a majority of Republican appointees, according to Wheeler.
 
Even the U.S. Court of Appeals for the 9th Circuit, often a bane for legal conservatives and a target of efforts by Republican senators to break it up, has become less Democratic as Trump picks have been tapped for the San Francisco-based court.
Should eligible Democrats take senior status or leave the bench in coming months, that would give the next president a significant pot of openings in the appeals courts to fill.
“You’re likely to see . . . a splurge of Democrats taking senior status” if Biden wins, Wheeler said.
The bottom line is that few are publicly predicting a de-escalation of the judicial wars that have been continuously ramped up by both Democrats and Republicans over the past few decades, with few political incentives for senators to reinstitute practices meant to encourage bipartisan sign-off on judges.
Democrats were responsible for the first partisan filibuster of a circuit court nominee and went “nuclear” to make it easier to confirm nearly all nominees. Republicans repeatedly blocked President Barack Obama’s choices for the influential U.S. Court of Appeals for the District of Columbia Circuit and ignored the nomination of Merrick Garland, Obama’s third Supreme Court pick, for eight months in 2016.
“It cuts both ways,” Cornyn said. “And that’s part of the problem.”


President Trump welcomed the Japanese prime minister at Mar-a-Lago, in front of a towering arrangement of roses. The two could have met in Washington, but Trump said his private club was a more comfortable alternative.
“It is, indeed, the Southern White House,” Trump said, greeting Prime Minister Shinzo Abe in front of the press in April 2018.
For Trump, there was another, hidden benefit. Money.
At Mar-a-Lago, Trump’s company would get paid to host his summit.
In the next two days, as Trump and Abe talked about trade and North Korea, Trump’s Palm Beach, Fla., club billed the U.S. government $13,700 for guest rooms, $16,500 for food and wine and $6,000 for the roses and other floral arrangements.
Trump’s club even charged for the smallest of services. When Trump and Abe met alone, with no food served, the government still got a bill for what they drank.
 
“Bilateral meeting,” the bill said. “Water.” $3 each.
Those 2018 payments, revealed here for the first time, are part of a long-running pattern whose scope has become clear only in recent months.
Since his first month in office, Trump has used his power to direct millions from U.S. taxpayers — and from his political supporters — into his own businesses. The Washington Post has sought to compile examples of this spending through open records requests and a lawsuit.
In all, he has received at least $8.1 million from these two sources since he took office, those documents and publicly available records show.


The president brought taxpayer money to his businesses simply by bringing himself. He’s visited his hotels and clubs more than 280 times now, making them a familiar backdrop for his presidency. And in doing so, he has turned those properties into magnets for GOP events, including glitzy fundraisers for his own reelection campaign, where big donors go to see and be seen.
 
Trump says the reason is comfort. “People like my product, what can I tell you, can’t help it,” he told reporters last year.
But documents show that visits by Trump, his family and his supporters have turned the government and the Republican Party into regular customers for the family business.
In the case of the government, Trump’s visits turned it into a captive customer, newly revealed documents show. What the government needed from Trump’s properties, it had to buy from Trump’s company.
So the more he went, the more he got. Since 2017, Trump’s company has charged taxpayers for hotel rooms, ballrooms, cottages, rental houses, golf carts, votive candles, floating candles, candelabras, furniture moving, resort fees, decorative palm trees, strip steak, chocolate cake, breakfast buffets, $88 bottles of wine and $1,000 worth of liquor for White House aides. And water.
 
Since Trump took office, his company has been paid at least $2.5 million by the U.S. government, according to documents obtained by The Post.
   Read the documents    Full PDF  
In addition, Trump’s campaign and fundraising committee paid $5.6 million to his companies since his inauguration in January 2017. Those payments — turning campaign donations into private revenue — continued even this year, as Trump fell behind in polls and his campaign ran short of money.
The combined total of these payments was more than Trump’s hotels in Vancouver and Hawaii brought him during the same period, according to financial disclosures.
The Trump Organization is not prohibited from accepting the payments. But the payments did break a key promise from 2016: Trump’s pledge that he would “completely isolate” himself from his business once in office, and put his voters’ interests above his own.
 
“If I win, I may never see my property — I may never see these places again,” Trump said on the campaign trail then. “Because I’m going to be working for you, I’m not going to have time to go play golf. Believe me.”
Trump still owns his businesses, but says he’s given day-to-day control to his eldest sons. There is no official total of what Trump’s company has been paid by the government and Trump’s campaign since he took office. The company and the campaign have both declined to say and did not respond to questions for this story.
White House spokesman Judd Deere also declined to give a total.


“Any suggestion that the President has used his own official travel or the federal government as a way to profit off of taxpayers is an absolute disgrace and lie,” Deere said in a statement.
Without an official accounting of these payments, The Post has sought to compile its own.
 
It relied on public databases of campaign spending, and hundreds of pages of federal spending records — obtained via public-records requests, public-records lawsuits and other means.
The result is a never-before-seen portrait of the presidency as a revenue stream.
While Trump was publicly donating his $400,000 annual presidential salary, he was privately using his power to bring his businesses far more than that.
“Americans elect a president to serve the people, not profit off them. Yet President Trump exploits his office to line his pockets with taxpayer dollars,” said Ryan Shapiro of the group Property of the People, whose lawsuits and public-records requests helped bring to light some of the earliest details of this spending.
Much spending remains hidden, because some federal agencies — including the State Department, and the White House itself — have declined to release records. “The amounts we’re seeing are just the tip of the iceberg,” Shapiro said.


Taxpayer payments
Taxpayer payments
The payments from taxpayers to Mar-a-Lago started in Trump’s first full month on the job, February 2017.
 
He was meeting Abe at the club. His aides would need rooms. According to federal policy, the most they could pay was $182.
But Mar-a-Lago was not charging $182.
“[There’s] a five bedroom house that three of the senior staff are staying in at $2,600 per night,” State Department employee Michael Dobbs wrote his colleagues, in an email later released to the public. “The two other Senior staffers (Bannon and Walsh) are expected to be charged $546 for their rooms.”
Within the State Department, emails show, officials did not seem inclined to fight. Federal rules allowed them to pay up to three times the normal limit — $546, in this case — with authorization. And the White House had authorized it. (Months later, Mar-a-Lago lowered the rate it charged the State Department to $396.15 per night, and provided partial refunds for some of the earlier charges above that.)
 
Within the White House, one former official said, some officials grumbled about holding the events at Mar-a-Lago. The events required dozens of staffers and enormous logistics, which had to be shoehorned into a private club on a narrow island full of other, nosy, paying guests. And there were some ethics concerns about the president repeatedly visiting his own properties.
“It’s a hell of a lot easier to do it at the White House, which is set up for it,” the former official said, speaking — like others — on the condition of anonymity because the person was not authorized to speak publicly. “It’s a pain in the [posterior] having those guys down there for the staff.”
Foreign leaders also sought the prestige of visiting the president at his vacation home because they believed it showed a close bond with the United States, two former officials said.
 
Trump returned, two months later, with Chinese President Xi Jinping.
“He was truly of the opinion that his property was better than anyone else’s property. And he wanted you to know it,” the former official said.




And Mar-a-Lago’s bills only got bigger that time, according to State Department records newly obtained by The Post. Now, there were florist bills: When Trump visited with Xi Jinping of China in April 2017, the club had started charging for flowers, and $50 per palm for decorative palm trees.
That same weekend, a group of White House staffers gathered in a Mar-a-Lago bar adorned with a large portrait of Trump wearing tennis whites. They kicked out the bartender “so they could speak confidentially,” according to an email Mar-a-Lago’s catering director sent to the State Department later.
The group then helped themselves to the contents of the bar: 26 servings of Patron and Don Julio tequila, 22 Chopin vodkas, and 6 glasses of Woodford Reserve bourbon, documents show.
The bill to the government: $1,005.60, including service charge. The State Department refused to pay, emails show. But ProPublica — which first revealed this bill — reported that the White House eventually did. (The White House has not responded to questions asking how much it has paid Trump’s clubs out of its own budget).
But the most expensive — and most famous — event of the weekend was the formal dinner for 30, where Trump informed Xi about U.S. missile strikes against Syria during dessert. “The most beautiful piece of chocolate cake that you’ve ever seen,” Trump later said in an interview with Fox Business Network.
Taxpayers likely paid for that: Mar-a-Lago charged $7,700 for that dinner, a charge that appears to have covered Trump’s food, as well.
Trump returned to the club a year later for another summit with Abe. The mood that time was more tense, with North Korean missile threats looming over the two leaders.
In preparation, Mar-a-Lago bought $6,000 worth of floral arrangements.
The list of preparations filled a full page: There were three kinds of candles (votive, floating, candelabra), centerpieces, vases — and a floral plan for even the smallest of meetings. Even “National Security Council pre-briefs” got their own centerpieces, the bill showed.
Taxpayers were billed for all of it, records show.
Mar-a-Lago’s florist, Julie Miner, declined to comment, citing a nondisclosure agreement.
