The president’s surrogates have championed it for him. Chad Wolf, Trump’s fifth and favorite Homeland Security chief, convened reporters in Texas on Thursday to extol the president’s record and autograph a border wall plaque engraved with Trump’s name to mark the completion of 400 new miles. And Miller had a call with reporters this past week to depict Biden’s immigration proposals as an existential threat that would trigger “a rush on the border on a global scale” and bankrupt the United States with a flood of newcomers.
White House aides and advisers long ago ceded control of the issue to Miller, giving him unrivaled influence over Trump’s agenda. Miller was the person who could best channel the president’s gut-level impulses, and fighting with him on the issue would ultimately hurt one’s political capital in the White House, two former officials said.
The president has regularly bragged about his support among Latinos, telling other advisers that he is doing better than he was in 2016 because they like his tough policies, a senior administration official said. He has asked for regular updates on the wall — hoping to brag about progress during the campaign, officials said — but has been less obsessed with other aspects of immigration policy.
Miller would regularly tell the president that various officials in U.S. agencies were trying to block his agenda, according to one former senior administration official who spoke on the condition of anonymity to discuss internal debate on the issue.
Several of the administration’s biggest crises, from the Muslim travel ban to the family separations at the border, were put together hastily with Miller’s involvement. Trump was supportive of both ideas before they happened, the senior administration official said, but became wobbly after implementation was poor and media coverage negative.
Trump would regularly discuss how the United States should try to get more immigrants from Europe — where his ancestors lived — and would recount violent acts he attributed to Mexican immigrants, one official said.
“POTUS was obsessed with the wall,” the official said. “You’d talk to Miller, and he barely talked about the wall. He was more looking to change the laws and where he could make real change.”
Those changes, measured in sheer numbers, have occurred in areas where Miller could have the most immediate impact. There has been a drop in the number of student visas issued under Trump, and most profoundly, in refugee admissions, at a time when demand is high. Nearly 26 million refugees are awaiting placement worldwide, according to the United Nations refugee agency, and about half are children and teens. Obama set the refugee cap at 110,000 during his last year in office; Trump has slashed the ceiling to 15,000 for the 2021 fiscal year. The drop in admissions from Muslim-majority countries has been more than 95 percent.
“It breaks my heart, completely breaks my heart. There’s a 13-year-old girl out there somewhere going through horrible trauma, genocide or persecution,” Besirevic said. “I think America has always been a welcoming country and needs to go back to be a welcoming country.”
Bandak Lul, 29, a refugee from South Sudan, said he “feels less welcome” today, aware of his status “as a refugee and a Black man in America.” The turning point for him, he said, was Trump referring to countries as “shitholes” without appearing to pay a price.
“This was a point where America fell into anti-refugeeness,” said Lul, who lives in Phoenix, where he works as a researcher at Arizona State University. “He’s been able to do whatever he wants ever since, and there hasn’t been anyone to speak up against him.”
Trump’s changes have pushed the boundaries of existing immigration laws to extremes the nation had never seen, advocates said.
He separated approximately 5,400 children from their parents at the southern border, and lawyers still do not know whether all of them have been reunited, said Lee Gelernt, deputy director of the American Civil Liberties Union’s Immigrants’ Rights Project. Even though courts did not allow Trump to stop people from seeking asylum, he has seized on the coronavirus pandemic to impose that policy anyway. His emergency measures have blocked thousands from entering the United States, waving off legal protections for vulnerable groups, including minors traveling without their parents.
Gelernt said lawyers on both sides have been run ragged in this administration. “There’s been enormous support for people fighting back, but ultimately the problem is that the federal government is so big and has so many resources that we’re ultimately always going to be mismatched,” he said. “We’re always going to be outgunned.” 


Trump’s approach also has transformed the immigration issue in the GOP. In the past, figures like the late senator John McCain, George W. Bush and Mitt Romney were openly supportive of legal immigration, reflecting the views of the corporate and business wing of the party. Trump defied that consensus.
Reaction to Trump’s immigration measures has pushed the Democratic Party further to the left on matters of immigration enforcement, during a term marked by social media eruptions over policies that drew far less attention under previous administrations.
The phrase “kids in cages” became a kind of catchall rebuke to the Trump approach, even though the chain-link enclosures they refer to were built under the Obama administration. At the time, during a 2014 border crisis, the air-conditioned warehouse with chain-link holding pens was considered a safer, more humane alternative to the sweltering garages border agents used to house detainees during previous migration spikes.
Immigration lawyers and nonprofit organizations have ramped up their efforts to block Trump’s policies, descending on airports in small armies, volunteering in remote locations to aid immigrants and challenging government policies in court. They volunteered to aid immigrants at remote border jails, monitored social media to counter Trump’s tweets, and speedily wrote legal briefs by staying up all night.
“We have literally been working around-the-clock, seven days a week, for the past four years,” said Gelernt. The ACLU has filed more than 100 immigration-related lawsuits over that time. “We’re fighting in the courts to stop policies, but we’re also fighting to regain some narrative in the public’s mind about who immigrants are and why they come to this country.”


A new term's impact
A new term's impact
Some polls suggest Trump’s approach has backfired. A July Gallup poll found that for the first time, Americans said they wanted more immigrants to come into the country rather than fewer. In all, 34 percent of Americans said they would like to see immigration to the United States increase, up from 27 percent the year prior and the highest level since 1965. The share that preferred decreasing immigration fell to 28 percent, a new low.
Immigrants account for 1 in 10 eligible voters, a record high, according to the Pew Research Center. More than 23 million immigrants are eligible to vote, nearly double the number a decade ago.
A Biden win would leave nearly every immigration measure vulnerable to reversal, however, even though some of the moves would take time and certainly would trigger litigation.
“[Trump] has fundamentally altered our immigration system without a single act of Congress,” said Ur Jaddou, who was chief counsel at U.S. Citizenship and Immigration Services under Obama. “They have flouted the traditional policy processes that allows for input from the public, and allows for input by career professionals. All of that has been cast aside, and that is how they were able to accomplish so much change so quickly.”
“Ultimately the question is: How do you undo damage that was done to decades of support for rational immigration policies, our refugee and naturalization systems? It’s a lot of things they have done that will take time to undo,” Jaddou said.
The November election also could determine the fate of the roughly 640,000 “Dreamers” who were spared deportation by the Deferred Action for Childhood Arrivals program. The Supreme Court ruled this year that Trump’s effort to terminate DACA was unlawful, but the court did not rule on the legality of the program itself, and the administration is preparing another try.
About 400,000 immigrants who have lived in the United States with a form of provisional residency known as temporary protected status (TPS) also face a threat of deportation if Trump is reelected.
Jacqueline Batres-Bonilla, 31, a graduate student and cancer survivor in Minnesota, could lose her home if the courts allow Trump to terminate TPS, which grants approximately 250,000 Salvadorans permission to live and work in the United States. She arrived in the United States at age 11.
Because TPS expires every 18 months or so, Batres-Bonilla said, her foothold in the United States has always been tenuous. But past administrations always renewed the permits, as long as immigrants paid their fees and passed background checks.
Under Trump, nobody came to their rescue. Now she and her husband — Marvin, 34, also a TPS recipient from El Salvador — could lose their home, work permits, driver’s licenses and careers. She is halfway through a master’s program in marriage and family therapy at Bethel University. He owns a business that installs carpeting and flooring and has nine employees. Her younger brother and sister are U.S. citizens studying for their bachelor’s degrees.
“They’re asking you to pack up 20 years of life, 20 years of what you have built, and just be gone?” she said. “Who does that?”
Batres-Bonilla, a Christian, said she finds comfort in prayer. But she said the stress can be overwhelming; she grinds her teeth and struggles to sleep.
“I can feel the anxiety in my body,” she said.
She and her husband bought a home last year in Burnsville, a city of 61,000 on Crystal Lake outside of St. Paul, and have continued to share their personal story with lawmakers on Zoom in hopes of being able to apply for U.S. citizenship one day. Months after her family arrived in Minnesota, doctors diagnosed her with uterine cancer. She survived after chemotherapy and surgery but is unable to bear children. She and her husband hoped to foster children and then adopt their own.
“I’ve lived here more than I lived in my own country,” she said. “It was never temporary for us. It was just the life we wanted to live.”
Much of Trump’s second-term immigration agenda is already known. He would build hundreds of additional miles of border barriers, further tighten work visas, try to punish sanctuary jurisdictions, give states and localities the ability to shut their doors to refugees and sew up the asylum system even tighter, administration officials say. And high on his list would be a push to change the principle that grants U.S. citizenship to anyone born on American soil.
The ACLU’s Gelernt said he expects more of the same if Trump is reelected.
“That’s the question on everyone’s mind: ‘What happens if there’s another four years?’ ” he said. “Can we keep up this same pace?








Early in the new administration, the White House wanted a big win for President Trump on one of his top campaign promises — getting rid of poor performers at the Department of Veterans Affairs.
Scott Foster got the order from his boss, a senior political appointee: Draw up a list of underachievers and give “your best 10” so the president could announce their firing at a signing ceremony for a law allowing fast dismissals at VA.
Foster, a seasoned personnel official, balked. The employees still had the right to due process, he argued. Within weeks, his boss tried to sack him.
It was one of the first shots in what became an unwavering four-year war on the civil servants who have operated as the backbone of the federal government for more than a century. Career employees from diplomats to budget analysts have come under siege as they carry out the laws of Congress, attacked by a president with no government experience and portrayed as a “deep state” trying to undermine him.
 
Trump has targeted high-profile figures such as Anthony S. Fauci, a government scientist who has advised six presidents and whose dire warnings about the coronavirus pandemic angered him. He ridiculed Lt. Col. Alexander Vindman, the decorated Iraq War veteran and Ukraine expert on the National Security Council staff who testified in the inquiry that led to Trump’s impeachment — then he ordered him marched out of his office with his twin brother, another career military officer.
Vindman retired in July after what his attorney called a campaign of White House intimidation and retaliation.


Beyond these recognizable faces, employees across the government were banished to basement offices, denied promotions and excluded from decision-making. Government service has been undermined in the process, employees and observers say, endangering not just the government’s routine functions, such as ensuring clean water and fighting wildfires, but also its response to rare events like pandemics.
 
When they challenged the legality of politically motivated orders, promoted the conclusions of experts or questioned the direction of policy, career employees found themselves sidelined. Some wound up on the president’s Twitter feed. Loyalty was prized above all.
In the past four fiscal years, the Office of Special Counsel, an independent anti-corruption office, has received 20,505 complaints from federal employees alleging government wrongdoing, retaliation for whistleblowing or other improper treatment, a 36 percent jump from President Barack Obama’s first term, data shows.
President Trump attacked former National Security Council official Lt. Col. Alexander Vindman while speaking to reporters on Feb. 11. (The Washington Post)
Rather than coax the workforce into executing his agenda, Trump and his team wrestled the bureaucracy into submission and touted the effort as a major achievement. They bristled at rules that prevent them from simply firing employees they do not like, as Trump did on “The Apprentice.”
 
The president went even further last week, signing an executive order that removes job protections for an estimated tens of thousands of civil servants, allowing them to be dismissed with little cause or recourse. The sweeping effort to crack the foundation of government employment probably would be rescinded if Joe Biden is elected president. But it shows the mistrust at the core of Trump’s worldview.
“It’s not how the enormous enterprise we call the federal government works,” said Donald Kettl, a public-affairs professor at the University of Texas at Austin. “Bending the apparatus of the state to his own will — there’s an authoritarian tint to that that is impossible to escape.”
White House spokesman Judd Deere, in a statement, called government workers “the Swamp,” saying they have “fought so hard against this President every step of the way” as he “fought tirelessly in his effort to make Washington accountable to the American people.”
 
“Many of these entrenched liberal bureaucrats are only out for themselves and never understood the importance of the President’s agenda or why the American people elected him,” Deere said.
Barry Bennett, a longtime Republican strategist who served in the George W. Bush administration, said that Bush fought similar roadblocks but that Trump broke through them, even though he installed fewer senior political appointees: “What is new is that Trump was able to get more of what he wanted done.”


'We move them out of the way'
'We move them out of the way'
The attacks mobilize the president’s base, which tends to hold government in low esteem.
Secretary of State Mike Pompeo acknowledged as much in a Florida radio interview this month. When host Bud Hedinger raised the prospect of “anti-Trump or deep-staters buried in the State Department” pushing back against Trump’s foreign policy agenda, the secretary said,“When we identify them, we move them out of the way.”
 
“We get them to a different place,” Pompeo continued, “and we try to find people only who are committed to doing America’s mission, President Trump’s mission, on behalf of the United States.”
Veterans of the hollowed-out diplomatic corps worry that rebuilding will take a generation.
At crisis points in his presidency, Trump has moved to silence government offices when their work reflected poorly on his leadership. As the pandemic exploded, he shifted key responsibilities of the Centers for Disease Control and Prevention to more-compliant political appointees elsewhere in the government. And he transferred much of the response to his son-in-law and senior adviser, Jared Kushner, who assembled a shadow task force, largely consisting of private industry players, that further confused lines of command.
 
The career staff takes policy direction from every White House, following the lead of political appointees. The staff, in turn, shares its knowledge to help the administration run the $4.5 trillion government, whose day-to-day challenges tend to be less political than technical.
Trump ran against big government four years ago and promised he would “cut so much your head will spin.” He didn’t.
The workforce of 2.1 million has grown about 1 percent, data from the Office of Personnel Management shows, as Trump advanced priorities such as veterans care, border security and the military and squeezed smaller agencies focused on science, diplomacy, the environment and labor. Those agencies have felt the president’s wrath.
Nowhere has Trump’s campaign to undermine career public servants been more forceful than at the Justice Department, where politics flowed into a system long insulated from partisan pressure.
 
Half a dozen career prosecutors resigned from high-profile cases this year to protest their belief that the president and his attorney general, William P. Barr, had sought to influence cases involving the president’s allies, undermining the agency’s most enduring principle of equal justice under law.
Many civil servants quit Trump’s government in frustration. Others were forced out, if not by overt firings then by efforts to make their jobs untenable. A growing number have gone public with their concerns.
Still others kept quiet, choosing to ride out the storm.
Longtime public servants worry the purges already have cut into public trust in a government on the cusp of producing a coronavirus vaccine. Public service may have lost its luster just as it needs a new generation to backfill a workforce preparing to retire.
 
Foster, 54, stayed at VA, taking a cut in pay and rank for a lower-profile personnel role teaching senior leaders not to retaliate. His attempted removal by Peter O’Rourke, who went on to become acting VA secretary before his firing, was stopped by the Office of Special Counsel. O’Rourke, who the VA inspector general found had used his power as head of an accountability office to end investigations of allies, did not returns calls seeking comment.
“I loved working there,” Foster said of his job at VA headquarters. “This broke my heart.”


'Not loyal to the flag'
'Not loyal to the flag'
Like Pompeo, some of Trump’s lieutenants made no secret of their distrust of their staff.
“I got 30 percent of the crew that’s not loyal to the flag,” Ryan Zinke, Trump’s first interior secretary, proclaimed to an oil industry group in 2017, complaining that his employees were sabotaging his shift toward a more business-friendly regulatory culture.
Soon Zinke had ordered the involuntary reassignment of dozens of the public lands agency’s most senior civil servants. A top target was Dan Wenk, the veteran superintendent of Yellowstone, the crown jewel of the national park system.
Wenk had planned to retire last year after finishing several wilderness preservation and conservation projects. But he clashed with Zinke over the bison population in the park, a point of contention with private ranchers whose cattle compete with them for pastureland. At the time, Zinke, a former congressman from Montana, needed to woo powerful ranchers as he eyed a future in state politics.
Wenk, 68, resisted Zinke’s order to move many of the bison out, saying there was no basis for it. In the spring of 2018 he was informed by form letter of a reassignment to Washington. He chose to retire early.
Wenk said his ouster was designed to send a clear message: “‘If we can do this to Dan Wenk, we can do it to anybody.’ How else do you control an agency with as broad public support as the Park Service?’’
Russell Travers met a similar fate after reaching the pinnacle of his career as acting director of the National Counterterrorism Center, created after the 9/11 attacks to monitor threats to the country.
A highly regarded intelligence professional, Travers went through official channels to report his worry that the Trump administration was eroding the center’s mission with budget cuts and the winnowing of experts detailed from government agencies. He was losing senior analysts: By last year his staff had declined by 16 percent since its high point six years ago.
Travers, 64, was removed from his job in March by the acting director of national intelligence at the time, Richard Grenell, with no explanation, he said. A spokeswoman said at the time that he was offered another assignment. Travers retired.
He now spends much of his time mentoring college students considering national security careers: “They’re asking, ‘Do I really want to get into government in this climate?’ ”
Pressure on scientists
Pressure on scientists
As Trump assumed control of the government, his antagonism toward the human role in climate change alarmed government scientists. Their dissent was immediate — and so were efforts to squelch it.
Scientists at the Park Service say political appointees have sought to censor their research if it clashes with the president’s ideology.
Patrick Gonzalez, the agency’s principal climate-change scientist, said that he has resisted pressure to cut references to human-induced warming in his academic writings and block him from speaking publicly about his work.
“In both cases the National Park Service attempted to violate scientific integrity, and in both cases I refused,” said Gonzalez, who also is an associate adjunct professor at the University of California at Berkeley and was not speaking in his official capacity. “I have continued my research and I’ve continued communicating, because communication is an important part of science.”
He continues to advise park officials at different sites, Gonzalez said, but when it comes to the agency’s senior leaders, “they don’t request my scientific advice.”
Asked whether Gonzalez was pressured, Interior Secretary David Bernhardt said in an interview, “I have never met with or talked to that person in my life.”
Bernhardt noted that he is married to a federal civil servant, was “the first secretary of either party to have a civil servant serving as my principal science adviser” and has regularly solicited guidance from career staffers through an ideas box.
Other scientists were less fortunate as they sought to promote their colleagues’ research.
The National Oceanic and Atmospheric Administration would not seem a typical target for political meddling. The agency regulates fisheries, maps U.S. coastal waters, predicts the weather and operates a multibillion-dollar satellite constellation.


It is also one of the world’s top climate research agencies. At first, NOAA’s civil servants, removed from the high-profile regulatory roles of the Environmental Protection Agency, did their jobs unimpeded.
Then in 2018 the agency released a congressionally mandated report warning that climate change is causing extensive harm to the country and will damage the U.S. economy if emissions are not sharply curtailed. The president said he did not believe its conclusions.
After a member of the communications team at the National Weather Service, which is part of NOAA, tweeted some of the climate-change findings, he got a formal reprimand and was told to stop tweeting on the agency’s accounts. About three months later, the official was transferred from the administrator’s suite to a low-profile office that helps local officials prepare for weather hazards. He asked not to be identified, for fear of retribution.
A NOAA spokesman said the official was moved to a different office as part of a change in priorities. The Weather Service’s media account has not tweeted about climate change since.
Bolton book
Bolton book
When the stakes for Trump were personal, the potential for collateral damage grew.
Ellen Knight had a top-level security clearance, 16 years of experience in government and a career filled with accolades when she was detailed to the White House in 2018 to lead pre-publication reviews at the National Security Council. National security adviser Robert C. O’Brien eventually put her in charge of a 14-member team of experts on classified information. A permanent management job at the NSC was assured.
The White House had assigned her a pre-publication review of an unflattering, tell-all book manuscript written by John Bolton, Trump’s former national security adviser.
Knight and her colleagues spent hundreds of hours with the manuscript, working with Bolton and his attorneys to remove classified information and damaging references.
